title,price,rating,reviews,availability,Category
Peter England Men's Everday Regular Fit Solid Shirt | Cotton Rich | 5-Pin Pocketing, ,4.0 out of 5 stars,554 ratings,Available to ship in 1-2 days,amazon_men shirt_data
Amazon Brand - Symbol Men's Cotton Shirt | Casual | Plain | Full Sleeve | Summer - Regular Fit (Available in Plus Size and Combo Packs), ,3.8 out of 5 stars,"7,182 ratings",In stock,amazon_men shirt_data
Amazon Brand - Symbol Men's Cotton Shirt | Chinese Collar | Casual | Plain | Full Sleeve | Summer - Regular Fit (Available in Plus Size and Combo Packs), ,3.9 out of 5 stars,"6,603 ratings",In stock,amazon_men shirt_data
Lymio Casual Regular Fit Shirt for Men|| Regular Fit Shirt for Men|| Men Stylish Regular Fit Shirt (Rib-Regular Fit Shirt), ,3.7 out of 5 stars,"2,056 ratings",In stock,amazon_men shirt_data
Men's Solid Linen Cotton Shirt | Casual | Plain | Full Sleeve | Summer-Regular Fit| Men Stylish Shirt | Everyday Formal Wear, ,2.8 out of 5 stars,55 ratings,In stock,amazon_men shirt_data
The Indian Garage Co Men Slim Fit Multi Striped Full Sleeves Cutaway Collar Casual Shirt, ,3.7 out of 5 stars,"1,340 ratings",In stock,amazon_men shirt_data
Majestic Man Men Classic Slim Fit Pure Cotton Casual Shirt, ,3.9 out of 5 stars,468 ratings,In stock,amazon_men shirt_data
CB-COLEBROOK Men's Casual Button Down Shirts Long Sleeve Linen Shirt Fashion Textured Beach Summer Shirts, ,3.9 out of 5 stars,"1,381 ratings",In stock,amazon_men shirt_data
CB-COLEBROOK Men's Regular Fit Solid Soft Touch Cotton Casual Shirt with Pocket Design with Spread Collar & Full Sleeves, ,3.8 out of 5 stars,"2,180 ratings",In stock,amazon_men shirt_data
IndoPrimo Men's Stylish Solid Satin Casual Shirt for Men Full Sleeve, ,4.2 out of 5 stars,455 ratings,In stock,amazon_men shirt_data
TAGDO Men's Regular Fit Casual Shirt (5171), ,4.0 out of 5 stars,710 ratings,In stock,amazon_men shirt_data
Pinkmint Casual Shirt for Men Stylish Men's Shirt Soild Regular Fit Long Sleeve Formal Wear Purple, ,3.5 out of 5 stars,405 ratings,In stock,amazon_men shirt_data
Men's Regular Fit Poly Popcorn Casual Shirt, ,3.1 out of 5 stars,9 ratings,In stock,amazon_men shirt_data
Lymio Regular Fit Shirt for Men|| Men Stylish Regular Fit Shirt (Resort-Slub), ,4.8 out of 5 stars,125 ratings,In stock,amazon_men shirt_data
DEELMO Men's Cotton Blend Mandarin Collar Self One Design Full Sleeve Casual Short Kurta, ,3.4 out of 5 stars,"1,049 ratings",In stock,amazon_men shirt_data
DEELMO Men's Stylish Solid Satin Casual Shirt for Men Full Sleeves| Poly Satin Silk Shirt, ,4.1 out of 5 stars,671 ratings,In stock,amazon_men shirt_data
Leriya Fashion Textured Shirts for Men||Regular Fit Casual Shirt for Men||Fancy Shirt||Men Full Sleeve Shirt||Plain Shirts for Men, ,3.8 out of 5 stars,"1,774 ratings",In stock,amazon_men shirt_data
Van Heusen Solid Formal Shirt for Men| Premium Cotton| Full Sleeves| Slim Fit |Breathable Fabric, ,3.9 out of 5 stars,"3,169 ratings",In stock,amazon_men shirt_data
The Indian Garage Co Men Slim Fit Checkered Full Sleeves Spread Collar Casual Shirt, ,3.8 out of 5 stars,50 ratings,In stock,amazon_men shirt_data
Allen Solly Men's Solid Slim Fit Shirt, ,3.8 out of 5 stars,"4,077 ratings",In stock,amazon_men shirt_data
Dennis Lingo Men's Slim Fit Casual Shirts, ,3.8 out of 5 stars,"40,455 ratings",In stock,amazon_men shirt_data
Dennis Lingo Men's Checkered Slim Fit Cotton Casual Shirt, ,3.8 out of 5 stars,"4,850 ratings",In stock,amazon_men shirt_data
Allen Solly Men's Plain Slim fit Shirt, ,3.6 out of 5 stars,"12,308 ratings",In stock,amazon_men shirt_data
"campus sutra Men's Collared Button Up Regular Fit Shirt For Casual Wear | Premium Stretchable Cotton Regular Fit Shirt Crafted With Regular Sleeve, Comfort Fit & High-Performance For Everyday Wear", ,3.6 out of 5 stars,245 ratings,In stock,amazon_men shirt_data
Majestic Man Men Small Checkered Slim Fit Cotton Casual Shirt, ,4.0 out of 5 stars,543 ratings,In stock,amazon_men shirt_data
TAGAS Men's Hexa Pattern Button Up Full Sleeve Shirt|| Shirt for Mens ||Regular Shirt for Mens ||(MS-Hexa), ,4.3 out of 5 stars,78 ratings,In stock,amazon_men shirt_data
Allen Solly Men's Printed Slim Fit Shirt, ,4.2 out of 5 stars,76 ratings,In stock,amazon_men shirt_data
Dennis Lingo Men's Slim Fit Casual Shirt, ,4.0 out of 5 stars,"2,433 ratings",Available to ship in 1-2 days,amazon_men shirt_data
Peter England Men's Slim Fit Full Sleeve Pin-Striped Formal Shirt | Cotton-Rich | Wonder Fabric | Pin Point Oxford, ,4.2 out of 5 stars,106 ratings,In stock,amazon_men shirt_data
"Dennis Lingo Men's Cotton Buffalo Check Slim Fit Casual Shirt with Pocket, Full Sleeve Shirt for Formal & Casual Wear (Also Available in Plus Size)", ,4.0 out of 5 stars,"7,145 ratings",In stock,amazon_men shirt_data
Leriya Fashion for Casual Stylish Printed Regular Fit | Men Formal Half Sleeve Shirt, ,4.1 out of 5 stars,57 ratings,In stock,amazon_men shirt_data
Peter England Men's Everyday Solid Slim Fit Full Sleeve Formal Shirt | Cotton-Rich, ,4.0 out of 5 stars,109 ratings,In stock,amazon_men shirt_data
Lymio Shirt for Men|| Regular Fit Shirt for Men|| Men Stylish Shirt (Tiedite-Shirt), ,4.7 out of 5 stars,43 ratings,In stock,amazon_men shirt_data
Amazon Brand - Symbol Men's Cotton Shirt | Chinese Collar | Casual | Plain | Full Sleeve | Summer - Regular Fit (Available in Plus Size and Combo Packs), ,3.9 out of 5 stars,"6,603 ratings",In stock,amazon_men shirt_data
GRECIILOOKS Shirt for Man | Men's Regular Fit Casual Shirt | Shirt | Shirt for Men | Old Money Shirt for Men, ,4.6 out of 5 stars,178 ratings,Available to ship in 1-2 days,amazon_men shirt_data
Van Heusen Formal Checkered Shirt for Men| Premium Cotton| Full Sleeves| Slim Fit |Breathable Fabric, ,3.9 out of 5 stars,"1,751 ratings",In stock,amazon_men shirt_data
The Indian Garage Co Men Slim Fit Checkered Full Sleeves Cutaway Collar Casual Shirt, ,4.0 out of 5 stars,314 ratings,In stock,amazon_men shirt_data
U-Turn Casual Shirt for Men || Shirt for Men Latest Stylish || Men Stylish Shirt || Men Printed Striped Shirt, ,3.7 out of 5 stars,"1,130 ratings",In stock,amazon_men shirt_data
Peter England Men's Everyday Ditsy Print Slim Fit Full Sleeve Casual Shirt | 100% Cotton, ,4.0 out of 5 stars,525 ratings,In stock,amazon_men shirt_data
Zombom Cotton Blend Solid Casual Regular Fit Mandarin/Chinese Collor Short Kurta for Men, ,3.8 out of 5 stars,"1,242 ratings",In stock,amazon_men shirt_data
IndoPrimo Men's Classic fit Plain Satin Casual Shirt for Men Full Sleeve, ,4.2 out of 5 stars,234 ratings,In stock,amazon_men shirt_data
Lymio Casual Regular Fit Shirt for Men|| Regular Fit Shirt for Men|| Men Stylish Regular Fit Shirt (Rib-Regular Fit Shirt), ,4.3 out of 5 stars,"2,056 ratings",In stock,amazon_men shirt_data
Majestic Man Men Box Checkered Slim Fit Cotton Casual Shirt, ,4.0 out of 5 stars,330 ratings,In stock,amazon_men shirt_data
IndoPrimo Men's Regular Fit Fancy Double Pocket Casual Shirt for Men Full Sleeves - Cargo, ,4.1 out of 5 stars,447 ratings,In stock,amazon_men shirt_data
Van Heusen Formal Micro Checkered Shirt for Men| Premium Cotton| Full Sleeves| Slim Fit |Breathable Fabric, ,3.9 out of 5 stars,676 ratings,In stock,amazon_men shirt_data
Allen Solly Men's Plain Slim fit Shirt, ,3.6 out of 5 stars,"12,308 ratings",In stock,amazon_men shirt_data
Louis Philippe Men's Easy to Care Cotton Slim fit Striped Casual Shirt with Natural Stretch, ,Previous page,,In stock,amazon_men shirt_data
JAI TEXTILES Men's Cotton Casual Printed Checkered Stylish Latest Shirt for Men (SkyBlue; Medium),₹399.00,Previous page,,In stock,amazon_men shirt_data
Pinkmint Mens Long Sleeve Button Down White Shirt for Men Collared Casual Formal Soild Shirt, ,3.6 out of 5 stars,841 ratings,In stock,amazon_men shirt_data
Louis Philippe Men's Premium Cotton Easy to Care Slim fit Textured Casual Shirt with Natural Stretch, ,3.0 out of 5 stars,12 ratings,In stock,amazon_men shirt_data
Peter England Men's Slim Fit Full Sleeve Striped Formal Shirt | Cotton Rich | Wonder Fabric | Pin Point Oxford, ,4.2 out of 5 stars,73 ratings,In stock,amazon_men shirt_data
Peter England Men's Slim Fit Shirt, ,3.8 out of 5 stars,4 ratings,In stock,amazon_men shirt_data
GRECIILOOKS Shirt for Men | Mens Casual Shirt | Men Stylish Shirt | Men Crochet Shirt | Men's Regular Fit | Men Formal Shirt | Men's Solid Slim Fit, ,4.1 out of 5 stars,279 ratings,In stock,amazon_men shirt_data
Majestic Man Solid Slim Fit Casual Shirt for Men, ,3.8 out of 5 stars,"1,768 ratings",In stock,amazon_men shirt_data
Dennis Lingo Men's Checkered Slim Fit Cotton Casual Shirt, ,3.8 out of 5 stars,"4,850 ratings",In stock,amazon_men shirt_data
Amazon Brand - Symbol Men's Cotton Shirt | Casual | Plain | Full Sleeve | Summer - Regular Fit (Available in Plus Size and Combo Packs), ,3.8 out of 5 stars,"7,182 ratings",In stock,amazon_men shirt_data
GRECIILOOKS for Casual Stylish Polycotton Regular Formal Shirt | Men's Solid Slim Fit, ,4.0 out of 5 stars,"2,183 ratings",In stock,amazon_men shirt_data
IndoPrimo Men's Casual Solid Satin Shirt for Men Full Sleeves, ,4.2 out of 5 stars,512 ratings,In stock,amazon_men shirt_data
Peter England Men's Slim Fit Full Sleeve Pin-Striped Formal Shirt | Cotton-Rich | Wonder Fabric | Pin Point Oxford, ,4.2 out of 5 stars,106 ratings,In stock,amazon_men shirt_data
The Souled Store Plaid: Waffle Black Men and Boys Long Sleeve Collared Neck Button Front Regular Fit Cotton Shirts, ,3.6 out of 5 stars,3 ratings,In stock,amazon_men shirt_data
U.S. POLO ASSN. Cotton Men's Slim Fit Casual Style Shirt, ,4.0 out of 5 stars,94 ratings,In stock,amazon_men shirt_data
Majestic Man Cotton Checkered Slim Fit Casual Shirt For Men, ,3.8 out of 5 stars,"1,412 ratings",In stock,amazon_men shirt_data
Allen Solly Men's Slim Fit Shirt, ,3.9 out of 5 stars,"7,735 ratings",In stock,amazon_men shirt_data
Dennis Lingo Men's Striped Slim Fit Cotton Casual Shirt, ,3.8 out of 5 stars,"2,023 ratings",In stock,amazon_men shirt_data
Dennis Lingo Men's Slim Fit Casual Shirt, ,4.0 out of 5 stars,"2,433 ratings",Available to ship in 1-2 days,amazon_men shirt_data
Arrow Men's Checkered Slim Fit Formal Shirt, ,4.1 out of 5 stars,320 ratings,In stock,amazon_men shirt_data
Arrow Men's Solid Slim Fit Formal Shirt, ,4.0 out of 5 stars,153 ratings,In stock,amazon_men shirt_data
Amazon Brand - Symbol Men's Solid Cotton Formal Shirt | Plain | Full Sleeve - Regular Fit (Available in Plus Size and Combo Packs), ,4.0 out of 5 stars,"8,900 ratings",In stock,amazon_men shirt_data
Amazon Brand - Symbol Men's Cotton Shirt | Chinese Collar | Casual | Plain | Full Sleeve | Summer - Regular Fit (Available in Plus Size and Combo Packs), ,4.0 out of 5 stars,299 ratings,In stock,amazon_men shirt_data
U.S. POLO ASSN. Men's Slim Fit Shirt, ,5.0 out of 5 stars,1 rating,In stock,amazon_men shirt_data
Amazon Brand - Symbol Men's Cotton Shirt | Casual | Plain | Full Sleeve | Summer - Regular Fit (Available in Plus Size and Combo Packs), ,3.8 out of 5 stars,"7,182 ratings",In stock,amazon_men shirt_data
Arrow Men's Checkered Full Sleeve Slim Fit Point Collar Cotton Casual Shirt, ,3.7 out of 5 stars,65 ratings,In stock,amazon_men shirt_data
Amazon Brand - Symbol Men's Solid 100% Cotton Slim Fit Formal Shirt, ,3.9 out of 5 stars,919 ratings,In stock,amazon_men shirt_data
Urbano Fashion Men's Cotton Full Sleeve Regular Fit Casual Checkered Shirt, ,Previous page,,Only 4 left in stock.,amazon_men shirt_data
The Souled Store Plaid: Waffle Black Men and Boys Long Sleeve Collared Neck Button Front Regular Fit Cotton Shirts, ,3.6 out of 5 stars,3 ratings,In stock,amazon_men shirt_data
U.S. POLO ASSN. Men's Regular Fit Shirt, ,2.0 out of 5 stars,1 rating,Only 4 left in stock.,amazon_men shirt_data
U.S. POLO ASSN. Cotton Men's Slim Fit Casual Style Shirt, ,4.0 out of 5 stars,94 ratings,In stock,amazon_men shirt_data
Amazon Brand - Symbol Men's Solid Cotton Formal Shirt | Plain | Full Sleeve - Regular Fit (Available in Plus Size and Combo Packs), ,4.0 out of 5 stars,"8,900 ratings",In stock,amazon_men shirt_data
Men's Half Sleeve Linen Shirt, ,3.8 out of 5 stars,289 ratings,In stock,amazon_men shirt_data
Levi's Men's Solid Slim Fit Shirt, ,4.0 out of 5 stars,136 ratings,In stock,amazon_men shirt_data
Amazon Brand - Symbol Men's Solid Cotton Rich Formal Shirt | Plain | Full Sleeve-Regular Fit (Available in Plus Size and Combo Pack of 2), ,3.8 out of 5 stars,"13,396 ratings",In stock,amazon_men shirt_data
Peter England Slim Fit Small Ditsy Printed Full Sleeve Shirt, ,4.0 out of 5 stars,256 ratings,Only 5 left in stock.,amazon_men shirt_data
Van Heusen Formal Striped Shirt for Men| Premium Cotton| Full Sleeves| Slim Fit |Breathable Fabric, ,3.9 out of 5 stars,372 ratings,In stock,amazon_men shirt_data
Peter England Men's Classic Textured Slim Fit Full Sleeve Shirt | Wonder Fabric | Cotton Rich | Premium Dobby, ,4.1 out of 5 stars,218 ratings,In stock,amazon_men shirt_data
Van Heusen Men's Solid Slim Fit Formal Shirt, ,3.9 out of 5 stars,158 ratings,In stock,amazon_men shirt_data
The Indian Garage Co Men Regular Fit Checkered Full Sleeves Cutaway Collar Casual Shirt, ,3.9 out of 5 stars,73 ratings,In stock,amazon_men shirt_data
Peter England Men's Slim Fit Full Sleeve Checkered Casual Shirt | 100% Cotton | Premium Twill Weave, ,4.1 out of 5 stars,308 ratings,In stock,amazon_men shirt_data
Allen Solly Men's Solid Regular Fit Shirt, ,3.8 out of 5 stars,870 ratings,In stock,amazon_men shirt_data
United Colors of Benetton Men's Slim Shirt, ,3.9 out of 5 stars,234 ratings,In stock,amazon_men shirt_data
BULLMER Trendy Regular Fit Printed Causal Shirt for Men - Pack of 1, ,3.9 out of 5 stars,372 ratings,In stock,amazon_men shirt_data
BE ACTIVE Men's Casual Shirt|| Cotton Stylish Full Sleeves Shirt for Men, ,3.6 out of 5 stars,198 ratings,In stock,amazon_men shirt_data
Amazon Brand - Symbol Men's Cotton Shirt | Chinese Collar | Casual | Plain | Full Sleeve | Summer - Regular Fit (Available in Plus Size and Combo Packs), ,3.9 out of 5 stars,"6,603 ratings",In stock,amazon_men shirt_data
Amazon Brand - Symbol Men's Solid Cotton Rich Formal Shirt | Plain | Full Sleeve-Regular Fit (Available in Plus Size and Combo Pack of 2), ,3.8 out of 5 stars,"13,396 ratings",In stock,amazon_men shirt_data
Lymio Casual Regular Fit Shirt for Men|| Regular Fit Shirt for Men|| Men Stylish Regular Fit Shirt (Rib-Regular Fit Shirt), ,4.3 out of 5 stars,"2,056 ratings",In stock,amazon_men shirt_data
Allen Solly Men's Slim Fit Shirt, ,3.9 out of 5 stars,"7,735 ratings",In stock,amazon_men shirt_data
U.S. POLO ASSN. Men's Solid Oxford Tailored Fit Button Down Casual Shirt, ,4.0 out of 5 stars,96 ratings,In stock,amazon_men shirt_data
Amazon Brand - Symbol Men's Solid Cotton Formal Shirt | Plain | Full Sleeve - Regular Fit (Available in Plus Size and Combo Packs), ,4.0 out of 5 stars,"8,900 ratings",Only 2 left in stock.,amazon_men shirt_data
Van Heusen Men's Solid Slim Fit Shirt, ,4.0 out of 5 stars,778 ratings,In stock,amazon_men shirt_data
"DAMENSCH Constant All-Degree Shirt for Men Full Sleeve, Pique Textured Shirt for Man, Thermoregulating Cotton Blend, Recycled Fabric Shirts Stylish", ,4.2 out of 5 stars,319 ratings,In stock,amazon_men shirt_data
Peter England Men's Slim Fit Full Sleeve Pin-Striped Formal Shirt | Cotton-Rich | Wonder Fabric | Pin Point Oxford, ,4.2 out of 5 stars,106 ratings,In stock,amazon_men shirt_data
Peter England Men's Everday Regular Fit Solid Shirt | Cotton Rich | 5-Pin Pocketing, ,4.0 out of 5 stars,554 ratings,In stock,amazon_men shirt_data
Majestic Man Men Comfort Slim Fit Opaque Checked Cotton Casual Shirt, ,3.8 out of 5 stars,58 ratings,In stock,amazon_men shirt_data
Louis Philippe Regular Fit Solid All Day Comfort Cotton Effortless Ironing Shirt, ,3.6 out of 5 stars,51 ratings,In stock,amazon_men shirt_data
Majestic Man Slim Fit Cotton Casual Check Shirt for Men, ,3.9 out of 5 stars,"2,743 ratings",In stock,amazon_men shirt_data
The Souled Store Plaid: Brown Mustard and Black Men and Boys Relaxed fit Striped Full Sleeve Cotton Multicolored Men Relaxed Shirts Shirt For Men Casual Half Sleeves Regular Fit Printed Stylish Latest, ,4.4 out of 5 stars,26 ratings,In stock,amazon_men shirt_data
Peter England Men's Classic Checkered Formal Slim Fit Full Sleeve Shirt | Wonder Fabric | Cotton-Rich, ,4.1 out of 5 stars,278 ratings,In stock,amazon_men shirt_data
Peter England Men's Classic Slim Fit Full Sleeve Oxford Shirt | 100% Cotton, ,4.0 out of 5 stars,447 ratings,In stock,amazon_men shirt_data
"Louis Philippe Slim Fit Premium Fabric, Superior Craftsmanship Casual Shirt", ,4.1 out of 5 stars,26 ratings,In stock,amazon_men shirt_data
Allen Solly Men's Regular Fit Polo, ,4.1 out of 5 stars,"6,444 ratings",In stock,amazon_men shirt_data
Majestic Man Men's Standard Slim Fit Striped Pure Cotton Casual Shirt, ,4.0 out of 5 stars,239 ratings,In stock,amazon_men shirt_data
Peter England Men's Striped Regular Fit Shirt, ,3.8 out of 5 stars,20 ratings,In stock,amazon_men shirt_data
The Indian Garage Co Men Regular Fit Solid Full Sleeves Spread Collar Casual Shirt, ,3.7 out of 5 stars,356 ratings,In stock,amazon_men shirt_data
Peter England Men's Solid Regular Fit Shirt, ,4.3 out of 5 stars,98 ratings,In stock,amazon_men shirt_data
BE ACTIVE Men's Casual Shirts|| Linen Cotton Lining Shirts for Men|| Stylish Full Sleeves Cotton Shirt for Men, ,3.5 out of 5 stars,277 ratings,In stock,amazon_men shirt_data
GRECIILOOKS Shirt for Men | Mens Casual Shirt | Men Stylish Shirt | Men Popcorn Shirt | Men's Regular Fit | Men Formal Shirt | Men's Solid Slim Fit, ,4.1 out of 5 stars,494 ratings,In stock,amazon_men shirt_data
Louis Philippe Men's Striped Regular Fit Shirt, ,Previous page,,In stock,amazon_men shirt_data
Majestic Man Cotton Checkered Slim Fit Casual Shirt For Men, ,3.8 out of 5 stars,"1,412 ratings",In stock,amazon_men shirt_data
Louis Philippe Men's Premium Cotton Easy to Care Slim fit Checks Casual Shirt with Natural Stretch, ,3.7 out of 5 stars,28 ratings,In stock,amazon_men shirt_data
Leriya Fashion Mens Rayon Man Casual Shirt Regular Fit Western, ,3.7 out of 5 stars,"2,782 ratings",In stock,amazon_men shirt_data
Van Heusen Men's Solid Slim Fit Formal Shirt, ,3.9 out of 5 stars,354 ratings,In stock,amazon_men shirt_data
Bellstone Men's Solid Regular Fit Dress Shirt, ,3.6 out of 5 stars,"1,855 ratings",In stock,amazon_men shirt_data
Majestic Man Men Slim Fit Pure Cotton Checkred Half Sleeve Casual Shirt, ,4.0 out of 5 stars,107 ratings,In stock,amazon_men shirt_data
Arrow Men's Checkered Full Sleeve Slim Fit Point Collar Cotton Casual Shirt, ,3.7 out of 5 stars,23 ratings,In stock,amazon_men shirt_data
Majestic Man Comfort Slim Fit Pure Cotton Checked Casual Shirt, ,4.0 out of 5 stars,6 ratings,Only 4 left in stock.,amazon_men shirt_data
Louis Philippe Men's Solid Slim Fit Shirt, ,5.0 out of 5 stars,1 rating,In stock,amazon_men shirt_data
Miraan Men's Casual Denim Cotton Shirt (SIGDENIMM), ,3.7 out of 5 stars,"2,290 ratings",In stock,amazon_men shirt_data
Louis Philippe Slim Fit Denim Classic Premium Casual Shirt, ,3.7 out of 5 stars,160 ratings,Available to ship in 1-2 days,amazon_men shirt_data
U.S. POLO ASSN. Men's Regular Fit Shirt, ,Previous page,,Only 2 left in stock.,amazon_men shirt_data
TAGDO Men's Jacquard Chain Polo Shirt (2020), ,4.4 out of 5 stars,240 ratings,In stock,amazon_men shirt_data
U.S. POLO ASSN. Men's Regular Fit Shirt, ,3.8 out of 5 stars,22 ratings,In stock,amazon_men shirt_data
Allen Solly Men's Regular Fit Ditsy Printed Casual Shirt, ,3.5 out of 5 stars,3 ratings,In stock,amazon_men shirt_data
Arrow Men's Slim Fit Shirt (ASADOSH02270_Beige, ,5.0 out of 5 stars,1 rating,Only 1 left in stock.,amazon_men shirt_data
MARK & ALBERT Men's Slim Fit Cotton Formal Shirt, ,3.9 out of 5 stars,80 ratings,Only 5 left in stock.,amazon_men shirt_data
Dennis Lingo Men's Striped Slim Fit Cotton Casual Shirt, ,3.8 out of 5 stars,"2,023 ratings",In stock,amazon_men shirt_data
Dennis Lingo Men's Checkered Slim Fit Cotton Casual Shirt, ,3.8 out of 5 stars,"4,850 ratings",In stock,amazon_men shirt_data
U.S. POLO ASSN. Men's Regular Fit Shirt, ,4.0 out of 5 stars,7 ratings,In stock,amazon_men shirt_data
Amazon Brand - Symbol Men's Solid Cotton Formal Shirt | Plain | Full Sleeve - Regular Fit (Available in Plus Size and Combo Packs), ,4.0 out of 5 stars,"8,900 ratings",In stock,amazon_men shirt_data
Arrow Men's Checkered Slim Fit Formal Shirt, ,4.1 out of 5 stars,320 ratings,In stock,amazon_men shirt_data
Allen Solly Men's Printed Slim Fit Shirt, ,4.2 out of 5 stars,76 ratings,In stock,amazon_men shirt_data
"DAMENSCH Constant All-Degree Shirt for Men Full Sleeve, Pique Textured Shirt for Man, Thermoregulating Cotton Blend, Recycled Fabric Shirts Stylish", ,4.2 out of 5 stars,319 ratings,In stock,amazon_men shirt_data
NOBERO Cotton Blend Oversized Casual Round Neck Co-Ord Set For Men Casual Sleepwear & Loungewear Set & Night Suits Set For Men, ,4.7 out of 5 stars,7 ratings,In stock,amazon_men shirt_data
NOBERO Men's Self Design Regular Fit Polo Shirt, ,Previous page,,In stock,amazon_men shirt_data
Amazon Brand - Symbol Men's Solid Cotton Rich Polo T Shirt | Collar Tshirts | Half Sleeves | Plain-Regular Fit (Available in Plus Size and Combo Pack of 2), ,3.9 out of 5 stars,"35,317 ratings",In stock,amazon_men shirt_data
Allen Solly Men's Plain Slim fit Shirt, ,3.6 out of 5 stars,"12,308 ratings",Only 1 left in stock.,amazon_men shirt_data
Peter England Men's Classic Slim Fit Full Sleeve Oxford Shirt | 100% Cotton, ,4.0 out of 5 stars,447 ratings,In stock,amazon_men shirt_data
Majestic Man Cotton Checkered Slim Fit Casual Shirt For Men, ,3.8 out of 5 stars,"1,412 ratings",In stock,amazon_men shirt_data
Majestic Man Slim Fit Cotton Casual Check Shirt for Men, ,3.9 out of 5 stars,"2,743 ratings",In stock,amazon_men shirt_data
Allen Solly Men's Solid Regular Fit Shirt, ,3.7 out of 5 stars,185 ratings,Only 5 left in stock.,amazon_men shirt_data
Allen Solly Men's Slim Fit Shirt, ,4.8 out of 5 stars,3 ratings,In stock,amazon_men shirt_data
Peter England Men's Regular Fit Shirt, ,3.9 out of 5 stars,21 ratings,In stock,amazon_men shirt_data
Peter England Men's Solid Regular Fit Shirt, ,4.0 out of 5 stars,79 ratings,In stock,amazon_men shirt_data
Majestic Man Pure Cotton Smart Slim Fit Opaque Solid Casual Shirt, ,3.8 out of 5 stars,18 ratings,Only 2 left in stock.,amazon_men shirt_data
Arrow Men's Solid Slim Fit Shirt, ,4.1 out of 5 stars,74 ratings,In stock,amazon_men shirt_data
Lymio Casual Shirt for Men|| Shirt for Men|| Men Stylish Shirt (Insta-Shirt), ,4.6 out of 5 stars,121 ratings,,amazon_men shirt_data
Men's Pure Khadi Cotton Regular Fit Half Sleeves Solid Casual Shirt, ,5.0 out of 5 stars,4 ratings,In stock,amazon_men shirt_data
Allen Solly Mens Slim Collar Slub Casual Shirt, ,4.6 out of 5 stars,7 ratings,In stock,amazon_men shirt_data
Arrow Men's Checkered Full Sleeve Slim Fit Point Collar Cotton Casual Shirt, ,3.7 out of 5 stars,65 ratings,In stock,amazon_men shirt_data
Park Avenue Men's Pure Cotton Checks Pattern Regular Fit Semi Cutaway Collar Half Sleeve Formal Shirt, ,4.4 out of 5 stars,21 ratings,In stock,amazon_men shirt_data
Louis Philippe Regular Fit Solid All Day Comfort Cotton Effortless Ironing Shirt, ,4.1 out of 5 stars,96 ratings,In stock,amazon_men shirt_data
Louis Philippe Men's Solid Slim Fit Shirt, ,Previous page,,In stock,amazon_men shirt_data
Lymio Men T-Shirt || T Shirt for Men (T-48-51), ,4.9 out of 5 stars,128 ratings,Only 1 left in stock.,amazon_men shirt_data
Lymio Men T-Shirt || T-Shirt for Men (Polo-59-62), ,4.5 out of 5 stars,74 ratings,In stock,amazon_men shirt_data
Amazon Brand - Symbol Men's Cotton Shirt | Chinese Collar | Casual | Plain | Full Sleeve | Summer - Regular Fit (Available in Plus Size and Combo Packs), ,3.9 out of 5 stars,"6,603 ratings",In stock,amazon_men shirt_data
Amazon Brand - Symbol Men's Cotton Shirt | Casual | Plain | Full Sleeve | Summer - Regular Fit (Available in Plus Size and Combo Packs), ,3.8 out of 5 stars,"7,182 ratings",In stock,amazon_men shirt_data
Louis Philippe Men's Easy to Care Cotton Slim fit Solid Casual Shirt with Natural Stretch, ,3.8 out of 5 stars,17 ratings,In stock,amazon_men shirt_data
GRECIILOOKS Shirt for Men | Mens Casual Shirt | Men Stylish Shirt | Men Popcorn Shirt | Men's Regular Fit | Men Formal Shirt | Men's Solid Slim Fit, ,4.1 out of 5 stars,494 ratings,In stock,amazon_men shirt_data
Allen Solly Men's Slim Fit Full Sleeve Striped Shirt, ,3.7 out of 5 stars,110 ratings,In stock,amazon_men shirt_data
BE ACTIVE Men's Casual Shirts|| Linen Cotton Lining Shirts for Men|| Stylish Full Sleeves Cotton Shirt for Men, ,3.5 out of 5 stars,277 ratings,In stock,amazon_men shirt_data
Men's Regular Fit Poly Popcorn Casual Shirt, ,2.8 out of 5 stars,5 ratings,In stock,amazon_men shirt_data
U.S. POLO ASSN. Men's Slim Fit Shirt, ,3.0 out of 5 stars,6 ratings,Only 1 left in stock.,amazon_men shirt_data
Leriya Fashion Mens Rayon Man Casual Shirt Regular Fit Western, ,3.7 out of 5 stars,"2,782 ratings",In stock,amazon_men shirt_data
Majestic Man Men's Standard Slim Fit Striped Pure Cotton Casual Shirt, ,4.0 out of 5 stars,239 ratings,In stock,amazon_men shirt_data
Park Avenue Men's Pure Cotton Checks Pattern Slim Fit Semi Cutaway Collar Full Sleeve Formal Shirt, ,4.2 out of 5 stars,70 ratings,In stock,amazon_men shirt_data
Peter England Men Pink Regular Fit Formal Shirt, ,5.0 out of 5 stars,2 ratings,In stock,amazon_men shirt_data
Louis Philippe Men's Easy to Iron Premium Cotton Wrinkle Resistant Slim fit Striped Formal Shirt, ,4.1 out of 5 stars,26 ratings,In stock,amazon_men shirt_data
IndoPrimo Men's Casual Solid Satin Shirt for Men Full Sleeves, ,4.2 out of 5 stars,512 ratings,In stock,amazon_men shirt_data
U.S. POLO ASSN. Men's Slim Fit Shirt, ,3.4 out of 5 stars,7 ratings,Only 1 left in stock.,amazon_men shirt_data
