title,price,rating,reviews,availability,Category
"MOLIRA Folding Sofa Cum Bed with Cushion for Home & Living Room | Mattress- Perfect for Guests | Jute Fabric I Foldable (Coffee, 3 * 6 Feet) 2-Person Sofa, Brown","₹3,299.00",2.9 out of 5 stars,34 ratings,Not Available,amazon_sofa_data
"Wakefit Sofa Set | 3 Year Warranty | Sofa 3 Seater, 3 Seater Sofa for Living Room, Wooden Sofa Set, Couch Sofa for Living Room, Sofa for Living Room - Tasmania(Fabric-Velvet : Blue)","₹25,001.00",4.4 out of 5 stars,4 ratings,,amazon_sofa_data
FUNTERIOR Innovative L-Shape Contempary 3 Seater Fabric Sofa Bed (Jazzy Blue),₹14699,4.3 out of 5 stars,3 ratings,Not Available,amazon_sofa_data
FURNY Menax 8 Seater Fabric LHS L Shape Sofa Set with 1 Centre Table & 2 Puffy (Light Grey),"₹27,699.00",4.4 stars,,Available to ship in 1-2 days,amazon_sofa_data
"ALATERRE HOME FURNITURE Sheesham Wood 3 Seater Sofa Cum Bed for Home, Sofa Cum Bed with Storage, Comfort Sofa Cum Bed Foldable, Modern & Unqiue Sofa Cum Bed, Honey Finish","₹31,339.00",4.8 out of 5 stars,20 ratings,In stock,amazon_sofa_data
Home Centre 3 Seater Helios Zara Fabric Sofa| Fabric Sofa| (Beige) |1 Year Warranty,"₹16,999.00",Previous page of related Sponsored Products,,Not Available,amazon_sofa_data
"Seventh Heaven Sofa Cum Bed with Ottoman - Jute Fabric Washable Cover Sofa Bed (Grey, 3 Seater - 72x60x14 (3Sit, 2 Sleep))","₹12,299.00",Previous page,,In stock,amazon_sofa_data
FURNY Aldora Leatherette 4 Seater RHS L Shape Sofa Set (Tan-Black),"₹46,199.00",4.4 stars,2 ratings,Available to ship in 1-2 days,amazon_sofa_data
"HS WOODCRAFT FURNITURE STORE Chesterfield 3-Piece Living Room Set, Tufted Leather Sofa and 2 Armchairs, Brown, Classic Design with Nailhead Trim","₹34,999.00",Previous page,,,amazon_sofa_data
"Screw & Art Basics 1 Seater Sofa Cum Bed, Jute Fabric Washable Cover, 3 x 6 ft (Purple)",₹7999,Previous page of related Sponsored Products,,Not Available,amazon_sofa_data
"WESTIDO Mac Leatherette 3-Person Sofa (Finish Color - Black, Diy(Do-It-Yourself))|1 Year Warranty","₹9,699.00",4.4 stars,9 ratings,In stock,amazon_sofa_data
"The Couch Cell Two-Seater Recliner Sofa, Brown Suede Velvet","₹29,000.00",4.4 out of 5 stars,6 ratings,In stock,amazon_sofa_data
FURNY Melrond 6 Seater RHS Fabric L Shape Sofa Set (Grey),"₹23,599.00",4.4 stars,1 rating,Available to ship in 1-2 days,amazon_sofa_data
Home Centre 3 Seater Berry Fabric Sofa|Fabric Sofa for Living Room|(Beige)|2 Year Warranty,"₹16,999.00",4.4 stars,943 ratings,Only 1 left in stock.,amazon_sofa_data
"AMATA Elegant 4 Seater Ocean Blue Suede Velvet Sofa with Two Cushions Perfect for Home Office Guests Living Room (L Shape, Ocean Blue1)(3 Year Warranty)","₹18,999.00",4.4 stars,361 ratings,In stock,amazon_sofa_data
"AMATA Eagle 3 Seater Sofa Cum Bed Camel Suede velevt fabricwith Two Cushions Perfect for Home Living Office Room and Guests (Camel, Medium)(3 Years Warranty)","₹15,649.00",4.4 stars,685 ratings,In stock,amazon_sofa_data
Rosebell Lightweight Easy 1-Person Sofa Cum Bed Jute Fabric- Washable Cover- Including Cushion - Size 3' X 6' Ft (Black Color) Perfect for Home & Office for Guests,"₹3,749.00",4.4 out of 5 stars,76 ratings,In stock,amazon_sofa_data
Rosebell 1-Seater Sofa Cum Bed with Printed Cushion – Space-Saving Convertible Sofa for Living Rooms - Grey Color,"₹4,199.00",4.3 out of 5 stars,29 ratings,In stock,amazon_sofa_data
"RUSTIC WILLOW Sellner 70"" Velvet Square Arm Tufted Seat Sofa 3 Seater Sofa Three Seater Sofa for Living Room (Olive Green)","₹18,999.00",Previous page,,,amazon_sofa_data
Royaloak Miami American Leatherette 2 Seater Sofa| Chic Leatherette 2 Tone Finish | Extra Large Seating Space | Wider Armrests | Chrome Finish Metal Legs | Durable Solid Wood Frame | Supports Back,"₹30,499.00",4.4 stars,2 ratings,Only 2 left in stock.,amazon_sofa_data
BBharat Lifestyle Dalvin Fabric 6 Seater Sofa (Finish Color-Black Grey),"₹25,949.00",5.0 out of 5 stars,1 rating,,amazon_sofa_data
SOFA SANCTUARY 4-Person Sofa Cum Bed Jute Fabric- Washable Cover- Including 4 Cushion - 6' X 6' Ft (Purple Color) Perfect for Home & Office for Guests,"₹7,884.05",4.9 out of 5 stars,9 ratings,In stock,amazon_sofa_data
Royaloak Sepang Malaysian Leatherette Sofa 2 Seater | Tufting Design | Pocket Springs for Extra Comfort | Flared Armrests | Solid Wood Frame Construction | High Backrest | Sofas for Living Room,"₹20,500.00",4.4 stars,,Only 1 left in stock.,amazon_sofa_data
Royaloak Milan Italian Half Leather 2 Seater Sofa | Genuine Body Touch Leather | High Backrest | Large Seating Space | Classic Tufting Design | Padded Armrests | Sturdy Solid Wood Frame,"₹39,000.00",4.4 stars,,Available to ship in 1-2 days,amazon_sofa_data
"Bharat Lifestyle Nano Fabric 6 Seater Sofa (Finish Color - Blue, DIY(Do-It-Yourself))","₹25,399.00",Previous page,,In stock,amazon_sofa_data
Home Centre 3 Seater Berry Fabric Sofa|Fabric Sofa for Living Room|(Beige)|2 Year Warranty,"₹16,999.00",4.4 stars,943 ratings,Only 1 left in stock.,amazon_sofa_data
"AMATA Elegant 4 Seater Ocean Blue Suede Velvet Sofa with Two Cushions Perfect for Home Office Guests Living Room (L Shape, Ocean Blue1)(3 Year Warranty)","₹18,999.00",4.4 stars,361 ratings,In stock,amazon_sofa_data
"Bharat Lifestyle Abot Leatherette 3 Seater Sofa (Finish Color - Black, DIY(Do-It-Yourself))","₹9,999.00",Previous page,,In stock,amazon_sofa_data
"Bharat Lifestyle Nano Fabric 6 Seater Sofa (Finish Color - Grey, DIY(Do-It-Yourself))","₹24,779.00",Previous page,,In stock,amazon_sofa_data
Royaloak Milan Italian Half Leather 2 Seater Sofa | Genuine Body Touch Leather | High Backrest | Large Seating Space | Classic Tufting Design | Padded Armrests | Sturdy Solid Wood Frame,"₹39,000.00",4.4 stars,,Available to ship in 1-2 days,amazon_sofa_data
"Bharat Lifestyle Rubik Fabric 6 Seater Sofa (Finish Color - Grey Blue, DIY(Do-It-Yourself))","₹24,999.00",Previous page,,In stock,amazon_sofa_data
BBharat Lifestyle Delta Fabric 3 Seater Sofa (Color - Dark Grey),"₹9,999.00",4.4 out of 5 stars,7 ratings,In stock,amazon_sofa_data
Seventh Heaven Sydney 6 Seater Left Corner Sofa | Luxury Comfort & Extra Spacious | Wooden Sofa Set for Living Room | Sofa for Living Room & Office (Polyster Holland - Sky Blue),"₹19,499.00",4.5 out of 5 stars,,In stock,amazon_sofa_data
Royaloak Muar Malaysian Fabric 3 Seater Sofa| Fabric Upholstery | Dual Tone Design | Plush Armrest | High Backrest | Tufting Design | Super Soft Cushions | Malaysian Collection,"₹27,000.00",4.4 stars,2 ratings,Only 1 left in stock.,amazon_sofa_data
"AMATA Eagle 3 Seater Sofa Cum Bed Ocean Blue Suede Velvet Fabric with Two Cushions Perfect for Home Living Office Room and Guests (Ocean Blue 2, Medium)(3 Year Warranty)","₹15,649.00",4.5 out of 5 stars,685 ratings,In stock,amazon_sofa_data
"Bharat Lifestyle Rubik Fabric 6 Seater Sofa (Finish Color - Grey, Blue, DIY(Do-It-Yourself))","₹17,999.00",Previous page,,In stock,amazon_sofa_data
Rosebell Lightweight Easy 1-Person Sofa Cum Bed Jute Fabric- Washable Cover- Including Cushion - Size 3' X 6' Ft (Brown Color) Perfect for Home & Office,"₹3,796.00",4.1 out of 5 stars,76 ratings,In stock,amazon_sofa_data
Home Centre 3 Seater Berry Fabric Sofa|Fabric Sofa for Living Room|(Beige)|2 Year Warranty,"₹16,999.00",4.4 stars,943 ratings,Only 1 left in stock.,amazon_sofa_data
"AMATA Elegant 4 Seater Ocean Blue Suede Velvet Sofa with Two Cushions Perfect for Home Office Guests Living Room (L Shape, Ocean Blue1)(3 Year Warranty)","₹18,999.00",4.4 stars,361 ratings,In stock,amazon_sofa_data
"AMATA Eagle 3 Seater Sofa Cum Bed Ocean Blue Suede Velvet Fabric with Two Cushions Perfect for Home Living Office Room and Guests (Ocean Blue 2, Medium)(3 Year Warranty)","₹15,649.00",4.5 out of 5 stars,685 ratings,In stock,amazon_sofa_data
Rosebell Lightweight Easy 1-Person Sofa Cum Bed Jute Fabric- Washable Cover- Including Cushion - Size 3' X 6' Ft (Black Color) Perfect for Home & Office for Guests,"₹3,749.00",4.1 out of 5 stars,76 ratings,In stock,amazon_sofa_data
AMAZART FURNITURE Sheesham Wood Sofa Cum Bed for Home || Wooden Sofa Cum Bed for Living Room || Sofa Cum Bed with Storage || Without Pillow || 3 Seater Sofa Cum Bed Foldable || Walnut Finish,"₹29,999.00",5.0 out of 5 stars,4 ratings,In stock,amazon_sofa_data
Rosebell 1-Seater Sofa Cum Bed with Printed Cushion – Space-Saving Convertible Sofa for Living Rooms - Grey Color,"₹4,199.00",4.5 out of 5 stars,29 ratings,In stock,amazon_sofa_data
"FurnMoq Solid Sheesham Wood 2 Seater Sofa for Living Room | Premium 2 Seater Sofa Set for Office & Home Furniture | Stylish Wooden Sofa for 2 People (Cairo Honey, 2 Seater)",₹24999,5.0 out of 5 stars,2 ratings,Not Available,amazon_sofa_data
Home Centre 3 Seater Sylvester Fabric Sofa| Fabric Sofa| (Grey) |Two Year Warranty,"₹31,999.00",4.4 stars,,Only 1 left in stock.,amazon_sofa_data
LEGACY OF COMFORT Prith Velvet Modern Cloud Sofa Upholstered 3 Seater Sofa Three Seater Sofa for Living Room Hotels & Offices (Beige),"₹33,249.00",5.0 out of 5 stars,3 ratings,,amazon_sofa_data
Royaloak Miami American Leatherette 2 Seater Sofa| Chic Leatherette 2 Tone Finish | Extra Large Seating Space | Wider Armrests | Chrome Finish Metal Legs | Durable Solid Wood Frame | Supports Back,"₹30,499.00",4.4 stars,2 ratings,Only 2 left in stock.,amazon_sofa_data
SOFA SANCTUARY 4-Person Sofa Cum Bed Jute Fabric- Washable Cover- Including 4 Cushion - 6' X 6' Ft (Purple Color) Perfect for Home & Office for Guests,"₹7,884.05",4.9 out of 5 stars,9 ratings,In stock,amazon_sofa_data
BBharat Lifestyle Dalvin Fabric 6 Seater Sofa (Finish Color-Black Grey),"₹25,949.00",5.0 out of 5 stars,1 rating,,amazon_sofa_data
Bacca Bucci Balancer Men's Fashion Sneakers Lace-Up Trainers Basketball Style Walking Shoes, ,4.1 out of 5 stars,"1,177 ratings",,amazon_sneakers_data
"Bacca Bucci® Men's Energy Afterburn Disruptor for Multiple Sports,Fashion, Party & Fun Shoes/Sneakers", ,3.7 out of 5 stars,"6,324 ratings",In stock,amazon_sneakers_data
Bacca Bucci Vengeance Korean Style High Top Streetwear Sneakers Casual Shoes for Men | Athletic-Inspired Ankle Length Shoes for Men, ,3.9 out of 5 stars,32 ratings,In stock,amazon_sneakers_data
Bacca Bucci STREETOLOGY High-top Streetwear Sneakers Casual Shoes for Men with Hook & Look Vamp Support | Athletic-Inspired Shoes for Men, ,4.0 out of 5 stars,21 ratings,In stock,amazon_sneakers_data
ASIAN Men's MEXICO-11 Casual Sneaker Shoes with Synthetic Upper Lightweight Comfortable Mid Top Sneaker Shoes for Men's & Boy's, ,4.7 out of 5 stars,694 ratings,In stock,amazon_sneakers_data
BRUTON Men's TARZEN-0340 Casual Sneaker Shoes with Synthetic Upper Lightweight Comfortable Mid Top Sneaker Shoes for Men's & Boy's, ,4.7 out of 5 stars,46 ratings,In stock,amazon_sneakers_data
ASIAN Men's TARZAN-04 Casual Sneaker Shoes with Synthetic Upper Lightweight Comfortable Mid Top Sneaker Shoes for Men's & Boy's, ,4.7 out of 5 stars,"1,612 ratings",In stock,amazon_sneakers_data
Campus OG-17 Men's Lace-Up Sneakers, ,4.7 out of 5 stars,31 ratings,In stock,amazon_sneakers_data
Campus OG-34 Men's Lace-Up Sneakers, ,4.0 out of 5 stars,29 ratings,In stock,amazon_sneakers_data
ASIAN Men's TARZAN-11 Casual Sneaker Shoes with Synthetic Upper Lightweight Comfortable Mid Top Sneaker Shoes for Men's & Boy's, ,4.7 out of 5 stars,"2,765 ratings",In stock,amazon_sneakers_data
adidas Mens Calicoz Sneaker Sneaker Shoes, ,4.8 out of 5 stars,7 ratings,In stock,amazon_sneakers_data
Puma Unisex Smashic Sneaker, ,4.7 out of 5 stars,"1,806 ratings",In stock,amazon_sneakers_data
Puma Unisex Court Classic Sneaker, ,4.5 out of 5 stars,110 ratings,Only 1 left in stock.,amazon_sneakers_data
BRUTON EVA Lite Sneakers Casual Shoes Walking Shoes for Men-White, ,3.0 out of 5 stars,2 ratings,In stock,amazon_sneakers_data
U.S. POLO ASSN. Mens Abor 2.0 Sneaker, ,3.6 out of 5 stars,7 ratings,In stock,amazon_sneakers_data
Skechers Mens Summits Brisbane Sneakers, ,4.1 out of 5 stars,830 ratings,In stock,amazon_sneakers_data
SPARX Mens Sm 439 Sneaker, ,4.2 out of 5 stars,"15,799 ratings",In stock,amazon_sneakers_data
Puma Unisex SF Drift Cat 5 Ultra II Sneaker, ,3.9 out of 5 stars,"1,102 ratings",In stock,amazon_sneakers_data
U.S. POLO ASSN. Men's Sneaker, ,4.2 out of 5 stars,264 ratings,In stock,amazon_sneakers_data
Woodland Men's Leather Casual Shoes, ,3.9 out of 5 stars,"1,475 ratings",In stock,amazon_sneakers_data
"SHOEGR Water Repellent Shoe Spray | Pack of 1 (100ML) Sneaker Protector | Liquid Stain Repellent for Leather, Nubuck, Suede & Canvas", ,3.4 out of 5 stars,41 ratings,In stock,amazon_sneakers_data
ALOUD CREATIONS Natural Sneaker & Shoe Cleaner Wipes | 1 Packs of 80 | Instant Sneakers Cleaner Wipes | Shoe Wipes Cleaning Kit to Remove Dirt & Stains on Footwear, ,4.2 out of 5 stars,5 ratings,In stock,amazon_sneakers_data
BRUTON Stylish Sneakers Casual Shoes for Men's & Boy's- White, ,4.7 out of 5 stars,76 ratings,In stock,amazon_sneakers_data
TCCO Natural Sneaker & Shoe Cleaner Wipes - 1 Packs of 80 - Portable Sneakers Cleaner Shoe Wipes Quickly Remove Dirt & Stains - These Disposable Shoe Cleaning Wipes Can Be Used On Footwear, ,4.3 out of 5 stars,"2,199 ratings",In stock,amazon_sneakers_data
U.S. POLO ASSN. Mens Stefan Sneaker, ,4.7 out of 5 stars,455 ratings,In stock,amazon_sneakers_data
U.S. Polo Assn. Mens Joan Sneakers, ,4.3 out of 5 stars,12 ratings,In stock,amazon_sneakers_data
Bata Mens Dash E 24 Sneakers, ,4.7 out of 5 stars,98 ratings,In stock,amazon_sneakers_data
The Souled Store Urban Blaze: Men and Boys Lace Up Low Top Sneakers, ,3.7 out of 5 stars,94 ratings,In stock,amazon_sneakers_data
U.S. POLO ASSN. Men's Sneaker, ,3.9 out of 5 stars,140 ratings,In stock,amazon_sneakers_data
ASIAN Men VEGAS-11N Stylish Casual Mid Top Sneakers and Trendy Shoes with Laces for Men & Boys | _VEGAS-11N$P, ,4.7 out of 5 stars,2 ratings,In stock,amazon_sneakers_data
U.S. POLO ASSN. Mens Gael 2.0 Sneaker, ,4.0 out of 5 stars,159 ratings,In stock,amazon_sneakers_data
ASIAN Men's White Casual Sneaker Hi-Neck Shoes with Synthetic Upper Lightweight Comfortable Mid Top Sneaker Shoes for Men's & Boy's Boston-13, ,3.6 out of 5 stars,290 ratings,In stock,amazon_sneakers_data
SilverArrow Stylish Trendy Lightweight Casual Comfortable Lace-up Sneaker Shoes for Boys & Mens Black, ,3.9 out of 5 stars,23 ratings,Only 4 left in stock.,amazon_sneakers_data
new balance Unisex-Adult Bb480 Sneaker, ,1.0 out of 5 stars,9 ratings,In stock,amazon_sneakers_data
ASIAN Men's Mexico-02 Casual Sneaker Shoes, ,4.7 out of 5 stars,494 ratings,In stock,amazon_sneakers_data
Cruiser Mens Sneaker | Comfort & Style with Soft Cushioned Insole | Trendy Lace-Up Design for Casual Outfits (2606), ,4.3 out of 5 stars,102 ratings,Only 5 left in stock.,amazon_sneakers_data
NIKE Mens Full Force LoRunning Shoe, ,3.9 out of 5 stars,288 ratings,In stock,amazon_sneakers_data
Puma Men's Court Shatter Low Sneaker, ,4.2 out of 5 stars,368 ratings,In stock,amazon_sneakers_data
U.S. POLO ASSN. Mens Rowan Grey Mid-Top Sneaker - 8 UK (2FD22525G07), ,5.0 out of 5 stars,3 ratings,In stock,amazon_sneakers_data
"JQR Signature Men's Casual Sneaker Shoes Synthetic Upper Lace up Design Soft Cushioned Memory Foam Insole Extra Grip Anti Skid Comfortable Lightweight Durable for Gym, Workout, Walking & Everyday", ,4.7 out of 5 stars,886 ratings,In stock,amazon_sneakers_data
Bata Mens Slipon Walking Shoe, ,4.0 out of 5 stars,"1,715 ratings",In stock,amazon_sneakers_data
Nike Mens Court Vision Lo Running Shoes, ,3.9 out of 5 stars,9 ratings,In stock,amazon_sneakers_data
Campus Brisk Men's Lace-Up Sneakers, ,4.7 out of 5 stars,86 ratings,In stock,amazon_sneakers_data
U.S. POLO ASSN. Mens Torm Sneaker, ,5.0 out of 5 stars,1 rating,In stock,amazon_sneakers_data
BADLAV Mens Causal Sneakers for Men|Comfortable Canvas Shoes Boys(b-009_White) Men's Sneakers, ,4.7 out of 5 stars,86 ratings,In stock,amazon_sneakers_data
U.S. POLO ASSN. Men's Sneaker, ,4.1 out of 5 stars,267 ratings,Only 4 left in stock.,amazon_sneakers_data
U.S. POLO ASSN. Men's Sneaker, ,3.3 out of 5 stars,46 ratings,In stock,amazon_sneakers_data
U.S. POLO ASSN. Men's Sneaker, ,4.7 out of 5 stars,"4,262 ratings",In stock,amazon_sneakers_data
U.S. POLO ASSN. Mens Adler 4.0 Sneaker, ,Previous page,,In stock,amazon_sneakers_data
U.S. Polo Assn. Mens DORIM Sneakers, ,4.6 out of 5 stars,11 ratings,In stock,amazon_sneakers_data
Bata Mens Spark E 24 Sneakers, ,3.7 out of 5 stars,23 ratings,In stock,amazon_sneakers_data
Puma Men's Maximal Comfort Walking Shoe, ,4.0 out of 5 stars,"3,174 ratings",In stock,amazon_sneakers_data
new balance Unisex-Adult 500 Sneaker, ,4.0 out of 5 stars,3 ratings,In stock,amazon_sneakers_data
BRUTON EVA Lite Sneakers Casual Shoes Walking Shoes for Men-White, ,5.0 out of 5 stars,2 ratings,In stock,amazon_sneakers_data
Puma Unisex-Adult 365215 Sneaker, ,4.0 out of 5 stars,"6,218 ratings",In stock,amazon_sneakers_data
Puma Unisex Smash v2 L Sneaker, ,4.7 out of 5 stars,30 ratings,In stock,amazon_sneakers_data
Puma Unisex-Adult Popcat 20 Res Slide, ,4.0 out of 5 stars,983 ratings,In stock,amazon_sneakers_data
"Elemnt Sports Shoes + Sneaker Cleaning Kit | Bengaluru FC Edition | Sports Shoe Cleaning Kit | Dirt & Stain Remover for Sports, Sneakers, Leather Shoes | One Shoe Cleaner Foam Spray 150ML + Brush", ,5.0 out of 5 stars,22 ratings,In stock,amazon_sneakers_data
AZARIA Sneaker & Shoe Cleaner Wipes 1 Pack of 80 Portable Sneaker Cleaner Shoe Wipes Quickly Remove Dirt & Stains - Disposable Shoe Cleaning Wipes for All Footwear White, ,4.4 out of 5 stars,52 ratings,In stock,amazon_sneakers_data
ASIAN Men's Mexico-02 Casual Sneaker Shoes, ,3.6 out of 5 stars,494 ratings,In stock,amazon_sneakers_data
Bacca Bucci Vengeance Korean Style High Top Streetwear Sneakers Casual Shoes for Men | Athletic-Inspired Ankle Length Shoes for Men, ,3.9 out of 5 stars,32 ratings,In stock,amazon_sneakers_data
U.S. POLO ASSN. Men's Sneaker, ,4.1 out of 5 stars,"4,262 ratings",In stock,amazon_sneakers_data
Puma Unisex MAPF1 Drift Cat Decima 2.0 Sneaker, ,3.9 out of 5 stars,59 ratings,In stock,amazon_sneakers_data
hummel Classic Verve Casual Suede Sneaker for Men Lightweight with Synthetic Suede Enhanced Comfort Cushioned Insole and Slip-Resistance Work and Play Business Casual Shoes, ,3.2 out of 5 stars,11 ratings,In stock,amazon_sneakers_data
Campus OGL-13 Women's Lace-Up Sneakers, ,4.8 out of 5 stars,68 ratings,In stock,amazon_sneakers_data
U.S. POLO ASSN. Mens Torm Sneaker, ,5.0 out of 5 stars,1 rating,In stock,amazon_sneakers_data
ASIAN Men's White Casual Sneaker Shoes with Synthetic Upper Lightweight Comfortable Mid Top Sneaker Shoes for Men's & Boy's Tarzan-05, ,4.7 out of 5 stars,372 ratings,In stock,amazon_sneakers_data
Bata Mens Dash E 24 Sneakers, ,3.4 out of 5 stars,98 ratings,In stock,amazon_sneakers_data
U.S. Polo Assn. Mens Joan Sneakers, ,4.3 out of 5 stars,12 ratings,In stock,amazon_sneakers_data
Campus OG-35 Men's Lace-Up Sneakers, ,4.4 out of 5 stars,68 ratings,In stock,amazon_sneakers_data
adidas Womens Streeet Icon Lite W Sneaker, ,Previous page,,In stock,amazon_sneakers_data
Campus OG-24 Men's Lace-Up Sneakers, ,3.5 out of 5 stars,33 ratings,In stock,amazon_sneakers_data
U.S. POLO ASSN. Men's Canvas Sneaker, ,3.6 out of 5 stars,"4,734 ratings",In stock,amazon_sneakers_data
ASIAN Men's BOSTON-01 White Casual Sneaker Shoes with Synthetic Upper Lightweight Comfortable Mid Top Sneaker Shoes for Men's & Boy's, ,3.7 out of 5 stars,397 ratings,In stock,amazon_sneakers_data
Campus Roar Men's Lace-up Sneaker, ,4.7 out of 5 stars,30 ratings,In stock,amazon_sneakers_data
BRUTON EVA Lite Sneakers Casual Shoes Walking Shoes for Men-White, ,3.0 out of 5 stars,2 ratings,In stock,amazon_sneakers_data
Nike Mens Court Vision Lo Running Shoes, ,3.9 out of 5 stars,9 ratings,In stock,amazon_sneakers_data
Puma Unisex Smash 3.0 Sneaker, ,4.5 out of 5 stars,78 ratings,Only 4 left in stock.,amazon_sneakers_data
U.S. POLO ASSN. Men's Sneaker, ,4.7 out of 5 stars,46 ratings,In stock,amazon_sneakers_data
"Cherry Blossom Sports Shoe Cleaner With Free Brush - 75Ml | Cleans All Non-Leather Shoes In Minutes, White",₹126.00,3.7 out of 5 stars,"2,213 ratings",In stock,amazon_sneakers_data
U.S. Polo Assn. Men's Sneaker, ,3.5 out of 5 stars,24 ratings,In stock,amazon_sneakers_data
LUDIC Eclipse Vegan Suede Sneakers for Men Work and Play Business Casual Shoes, ,4.7 out of 5 stars,25 ratings,In stock,amazon_sneakers_data
Centrino Mens 7711 Casual Shoes | Lace-Up Casual Sneakers | Provide Comfort & Stylish, ,3.6 out of 5 stars,819 ratings,Only 1 left in stock.,amazon_sneakers_data
BRUTON Men's TARZEN-0340 Casual Sneaker Shoes with Synthetic Upper Lightweight Comfortable Mid Top Sneaker Shoes for Men's & Boy's, ,4.7 out of 5 stars,46 ratings,In stock,amazon_sneakers_data
Campus OG-D1 Men's Lace-Up Sneakers, ,4.7 out of 5 stars,165 ratings,In stock,amazon_sneakers_data
Nike Mens Big Low Running Shoes, ,4.7 out of 5 stars,15 ratings,In stock,amazon_sneakers_data
Cruiser Mens Sneaker | Comfort & Style with Soft Cushioned Insole | Trendy Lace-Up Design for Casual Outfits (2606), ,4.3 out of 5 stars,102 ratings,In stock,amazon_sneakers_data
Bacca Bucci Grand Men's Exclusive X9X Elevated Sneakers, ,4.0 out of 5 stars,391 ratings,In stock,amazon_sneakers_data
"Bacca Bucci VEERA Mid-top White Sneakers for Men | Athletic Yet Sleek, Futuristic Design", ,4.7 out of 5 stars,191 ratings,In stock,amazon_sneakers_data
Cruiser Chunky Sneaker for Men | Bold & Stylish Design | Lightweight & Comfortable | Gymwear & Casual Outfits | Durable Footwear (2630), ,4.2 out of 5 stars,188 ratings,In stock,amazon_sneakers_data
Nike Mens Court Royale 2 Low TOP, ,2.4 out of 5 stars,4 ratings,In stock,amazon_sneakers_data
SPARX Mens Sm 162 Sneaker, ,4.1 out of 5 stars,"18,562 ratings",In stock,amazon_sneakers_data
"JQR Signature Men's Casual Sneaker Shoes Synthetic Upper Lace up Design Soft Cushioned Memory Foam Insole Extra Grip Anti Skid Comfortable Lightweight Durable for Gym, Workout, Walking & Everyday", ,4.7 out of 5 stars,886 ratings,In stock,amazon_sneakers_data
Zaydn ASH Sneaker for Men | Soft Cushioned Insole & Lightweight | Stylish Lace-Up Shoes with Causal Outfits | Trendy Sneakers | Shoes for Man | Low Top Sneaker Shoes, ,3.7 out of 5 stars,127 ratings,In stock,amazon_sneakers_data
Cruiser Mens Sneaker | Comfort & Style with Soft Cushioned Insole | Trendy Lace-Up Design for Casual Outfits (2606), ,4.3 out of 5 stars,102 ratings,Only 5 left in stock.,amazon_sneakers_data
ASIAN Men's BOSTON-02 White Casual Sneaker Shoes with Synthetic Upper Lightweight Comfortable Mid Top Sneaker Shoes for Men's & Boy's, ,4.7 out of 5 stars,299 ratings,In stock,amazon_sneakers_data
ASIAN Men's White Casual Sneaker Hi-Neck Shoes with Synthetic Upper Lightweight Comfortable Mid Top Sneaker Shoes for Men's & Boy's Boston-11, ,4.7 out of 5 stars,68 ratings,In stock,amazon_sneakers_data
Bata 8512 Aston E Grey Casual Sneakers Sport Shoes for Mens | Ideal for Gym |Running| Walking |Sporty Aesthetics Shoes with Lightweight & Stylish Look, ,2.1 out of 5 stars,9 ratings,In stock,amazon_sneakers_data
"ASIAN Men MEXICO-01 Stylish Casual Mid-Top Sneaker and Trendy Shoes with Laces for Men & Boys, Perfect for Wearing to Outings, and Comfortable All-Day Use, Lightweight and Durable", ,3.9 out of 5 stars,12 ratings,In stock,amazon_sneakers_data
Nike Mens Court Vision Lo Running Shoes, ,4.1 out of 5 stars,66 ratings,In stock,amazon_sneakers_data
Puma Unisex Rebound Future NextGen Sneaker, ,4.2 out of 5 stars,66 ratings,Only 1 left in stock.,amazon_sneakers_data
Campus OG-10 Men's Lace-Up Sneakers, ,3.7 out of 5 stars,61 ratings,In stock,amazon_sneakers_data
Puma Unisex-Adult Shoes, ,3.9 out of 5 stars,101 ratings,In stock,amazon_sneakers_data
Puma Men's Court Shatter Low Sneaker, ,4.2 out of 5 stars,368 ratings,In stock,amazon_sneakers_data
U.S. POLO ASSN. Men's Sneaker, ,3.9 out of 5 stars,102 ratings,In stock,amazon_sneakers_data
Puma Unisex Caven 2.0 Mid WTR Sneaker, ,4.3 out of 5 stars,84 ratings,In stock,amazon_sneakers_data
"adidas Men's Streeet Icon Lite M Sneaker Shoes, Black, UK-11", ,Previous page,,In stock,amazon_sneakers_data
ASIAN Men VEGAS-11N Stylish Casual Mid Top Sneakers and Trendy Shoes with Laces for Men & Boys | _VEGAS-11N$P, ,4.7 out of 5 stars,2 ratings,In stock,amazon_sneakers_data
Woodland Men's Leather Casual Shoes, ,3.8 out of 5 stars,745 ratings,In stock,amazon_sneakers_data
Puma Men's Anzarun Camo Sneaker, ,4.0 out of 5 stars,96 ratings,In stock,amazon_sneakers_data
ASIAN Casual Sneaker Shoes for Men | Soft Cushioned Insole || MOSCOW-12 Sneakers for Men, ,4.7 out of 5 stars,404 ratings,In stock,amazon_sneakers_data
"ASIAN Carnival-02 Men's High Top Casual Chunky Fashion Sneakers,Dancing Shoes | Basketball Shoes with Rubber Outsole for Boys…", ,4.1 out of 5 stars,810 ratings,In stock,amazon_sneakers_data
"Sparx Mens SM 852 | Stylish, Comfortable | Grey Sneaker - 9 UK (SM 852)", ,3.8 out of 5 stars,3 ratings,Only 3 left in stock.,amazon_sneakers_data
Campus OG-D3 Men's Lace-Up Sneakers, ,3.7 out of 5 stars,108 ratings,In stock,amazon_sneakers_data
Skechers Men's Flex Advantage 3.0 Sneaker, ,3.8 out of 5 stars,"2,033 ratings",In stock,amazon_sneakers_data
U.S. POLO ASSN. Men's Canvas Sneaker, ,4.5 out of 5 stars,171 ratings,In stock,amazon_sneakers_data
Campus OG-D2 Men's Lace-Up Sneakers, ,3.5 out of 5 stars,48 ratings,In stock,amazon_sneakers_data
Puma Women's Whizzlite Sneaker, ,4.0 out of 5 stars,93 ratings,In stock,amazon_sneakers_data
Red Chief Genuine Leather Sneaker Lace Up | Casual Shoes for Men | TPR Sole, ,4.7 out of 5 stars,"1,362 ratings",Only 1 left in stock.,amazon_sneakers_data
Puma Men's Smash Pop Sneaker, ,3.0 out of 5 stars,4 ratings,Only 2 left in stock.,amazon_sneakers_data
Puma Unisex Shuffle Perf RES Sneaker, ,3.8 out of 5 stars,23 ratings,In stock,amazon_sneakers_data
