title,price,rating,reviews,availability,Category
"Boult Audio Z20 Pro Truly Wireless Bluetooth Ear Buds with 60H Playtime, 4 Mics Clear Calling, 45ms Low Latency, Rich Bass Drivers, Touch Controls, IPX5 TWS Earbuds Bluetooth Wireless (Powder Blue)",₹999.00,4.0 out of 5 stars,"4,137 ratings",In stock,amazon_headphone_data
"Boult Newly Launched Flex Over Ear Bluetooth Headphones with 70H Playtime, 40mm Bass Drivers, Zen™ ENC Mic, Type-C Fast Charging, 4 EQ Modes, Bluetooth 5.4, AUX Option, IPX5 Navy Blue","₹1,299.00",Previous page,,In stock,amazon_headphone_data
"soundcore V20i by Anker Open-Ear Headphones, Adjustable Ear Hooks, Ultra-Comfort, Snug Fit, Powerful Sound, Clear Calls, IP55, LED Lights, 36H Playtime, Bluetooth 5.4 Earbuds, Multipoint Connection","₹2,499.00",4.4 out of 5 stars,"3,172 ratings",In stock,amazon_headphone_data
"Sennheiser Hd 560S Over-The-Ear Wired Audiophile Over Ear Headphones-Neutral Frequency Response,Lifelike Sound with Open-Back Design,Wide Soundstage,Natural&Accurate Sound for Gamers,Detachable Cable","₹10,990.00",4.6 out of 5 stars,"2,715 ratings",In stock,amazon_headphone_data
"Sony WH-1000XM4 Noise Cancellation Wireless Bluetooth Over-Ear Headphones with Mic, Hi-Res Audio, Up to 38Hrs Battery- Silver","₹20,975.00",4.5 out of 5 stars,"55,670 ratings",In stock,amazon_headphone_data
"EPOS PC 8 USB A On-Ear Stereo Wired Headset with Microphone, Wired Headphones, Inline Volume Control, Mute Function, Noise-Canceling Microphone, for Laptop, PC, Mac - Online Calls, Teaching","₹2,421.00",3.9 out of 5 stars,"16,308 ratings",In stock,amazon_headphone_data
Ant Esports H520W World Of Warships Edition Lightweight Gaming Over Ear Wired Headphones with Mic| 3.5MM Jack |50 MM Drivers | Compatible with PC/ PS4 / Xbox One / Nintendo / Mobile (White),₹655.00,3.6 out of 5 stars,"4,039 ratings",In stock,amazon_headphone_data
"JBL Tune 510BT, On Ear Wireless Headphones with Mic, up to 40 Hours Playtime, Pure Bass, Quick Charging, Dual Pairing, Bluetooth 5.0 & Voice Assistant Support for Mobile Phones (Blue)","₹1,999.00",4.0 out of 5 stars,"2,123 ratings",In stock,amazon_headphone_data
"Zebronics Jet PRO Premium Wired Gaming On Ear Headphone with LED for Headband + earcups, 40mm Neodymium Drivers, 2 Meter Braided Cable, with mic, Suspension Design, 3.5mm + USB Connector (Black, Blue)",₹799.00,3.9 out of 5 stars,"2,466 ratings",In stock,amazon_headphone_data
"boAt New Launch Rockerz 551 ANC Pro, 42dB Adaptive Hybrid ANC, App Support, 72Hrs Battery, 40mm Titanium Drivers, ENx Tech, Foldable Cups Bluetooth Headphones, Wireless Headphone with Mic (Bold Blue)","₹3,499.00",3.7 out of 5 stars,103 ratings,In stock,amazon_headphone_data
"Sony WH-CH720N Noise Cancellation Wireless Bluetooth Over Ear Headphones with Mic, Up to 35Hrs Battery- White","₹7,874.00",4.3 out of 5 stars,"10,114 ratings",In stock,amazon_headphone_data
"Boult K10 Truly Wireless Bluetooth In Ear Earbuds with 50H Playtime, 4 Mic Clear Calling, 45ms Low Latency, 10mm Drivers, Touch Controls, Type-C Fast Charging, IPX5, TWS Ear buds Wireless (Pure Black)",₹699.00,4.1 out of 5 stars,"3,808 ratings",In stock,amazon_headphone_data
"Boult Audio Z20 Pro Truly Wireless Bluetooth Ear Buds with 60H Playtime, 4 Mics Clear Calling, 45ms Low Latency, Rich Bass Drivers, Touch Controls, IPX5 TWS Earbuds Bluetooth Wireless (Powder Blue)",₹999.00,4.0 out of 5 stars,"4,137 ratings",In stock,amazon_headphone_data
"boAt Rockerz 430, 40mm Drivers, Beast Mode (40ms Latency), 40hrs Playback, ENx Tech, Voice Assistant, BTv5.4, Adaptive Fit & Easy Access Controls, Bluetooth Over Ear Headphones(Bold Blue)","₹1,199.00",3.1 out of 5 stars,955 ratings,In stock,amazon_headphone_data
"ZEBRONICS Thunder Max Bluetooth Over Ear Headphone with 120*Hrs Playback, 3 EQ Modes, 40mm Bass Driver, Fast Charging, ENC, Gaming Mode, Dual Pairing, BT v5.4, AUX, Metallic Finish (Black)","₹1,099.00",3.6 out of 5 stars,209 ratings,In stock,amazon_headphone_data
"Bose New QuietComfort Ultra Wireless Noise Cancelling Headphones with Spatial Audio, Over-The-Ear Headphones with Mic, Up to 24 Hours of Battery Life, White Smoke","₹28,699.00",4.4 out of 5 stars,"6,136 ratings",In stock,amazon_headphone_data
"Noise Newly Launched Airwave Max 5 Wireless Over-Ear Headphones with Adaptive Hybrid ANC (up to 50dB), HFA Tech, 80H Playtime, Dual Pairing(Calm White)","₹4,999.00",4.2 out of 5 stars,121 ratings,In stock,amazon_headphone_data
"JBL Live 770NC True Adaptive Noise Cancellation Headphones Wireless Over Ear, Spatial Sound, 65Hrs Playtime, Speed Charge, Multipoint Connect and Personi-Fi 2.0, BT 5.3, Google Fast Pair, Alexa, Black","₹8,999.00",4.2 out of 5 stars,934 ratings,In stock,amazon_headphone_data
Apple EarPods (USB-C) ​​​​​​​,"₹1,549.00",4.2 out of 5 stars,"2,741 ratings",In stock,amazon_headphone_data
"boAt Rockerz 460 Wireless Over Ear Headphones w/Up to 30hrs Playtime, 40mm Drivers, Beast™ Mode, ENx™, Dual Pairing, BT v5.2, Instant Voice Assistant, Adaptive Fit(Crimson White)",₹999.00,4.0 out of 5 stars,352 ratings,In stock,amazon_headphone_data
Sennheiser Professional Audio HD 280 PRO Wired Over Ear Headphones without microphone,"₹6,990.00",4.2 out of 5 stars,"7,752 ratings",In stock,amazon_headphone_data
"Boult Audio Z40 True Wireless in Ear Earbuds with 60H Playtime, Zen™ ENC Mic, Low Latency Gaming, Type-C Fast Charging, Made in India, 10mm Rich Bass Drivers, IPX5, Bluetooth 5.3 Ear Buds TWS (Blue)",₹799.00,3.8 out of 5 stars,"33,610 ratings",In stock,amazon_headphone_data
"HAMMER Bash Max Over The Ear Wireless Bluetooth Headphones with Mic, Touch Control, Deep Bass, Upto 40 Hours Playtime, Bluetooth 5.3, Workout/Travel (Cool Grey)","₹1,999.00",3.7 out of 5 stars,"3,242 ratings",In stock,amazon_headphone_data
"Boult K10 Truly Wireless Bluetooth In Ear Earbuds with 50H Playtime, 4 Mic Clear Calling, 45ms Low Latency, 10mm Drivers, Touch Controls, Type-C Fast Charging, IPX5, TWS Ear buds Wireless (Pure Black)",₹699.00,4.1 out of 5 stars,"3,808 ratings",In stock,amazon_headphone_data
"Boult Newly Launched Flex Over Ear Bluetooth Headphones with 70H Playtime, 40mm Bass Drivers, Zen™ ENC Mic, Type-C Fast Charging, 4 EQ Modes, Bluetooth 5.4, AUX Option, IPX5 Navy Blue","₹1,299.00",Previous page,,In stock,amazon_headphone_data
URBN Thump 550 Bluetooth 5.4 Wireless On Ear Headphone | HD Sound | Deep Bass | in-Built Mic | Type-C Charging | Foldable | Aux | Micro SD Card | 1 Year Replacement Warranty (Camo),"₹1,234.00",4.8 out of 5 stars,21 ratings,In stock,amazon_headphone_data
Sony ZX Series MDR-ZX310AP Headband Stereo Headset -Blue,"₹1,331.00",3.9 out of 5 stars,829 ratings,In stock,amazon_headphone_data
"ZEBRONICS Thunder Over Ear Bluetooth 5.3 Wireless Headphones with 60H Backup, Gaming Mode, Dual Pairing, Enc, Aux, Micro Sd, Voice Assistant, Comfortable Earcups, Call Function (Brown)",₹699.00,3.8 out of 5 stars,"76,711 ratings",In stock,amazon_headphone_data
Apple EarPods (USB-C) ​​​​​​​,"₹1,549.00",4.2 out of 5 stars,"2,741 ratings",In stock,amazon_headphone_data
"JBL Tune 770NC Wireless Over Ear ANC Headphones with Mic, Upto 70 Hrs Playtime, Speedcharge, Google Fast Pair, Dual Pairing, BT 5.3 LE Audio, Customize on JBL Headphones App (Blue)","₹5,099.00",4.0 out of 5 stars,"20,207 ratings",In stock,amazon_headphone_data
"Boat Rockerz 255 Pro+, 60HRS Battery, Fast Charge, IPX7, Dual Pairing, Low Latency, Magnetic Earbuds, Bluetooth Neckband, Wireless with Mic Earphones (Active Black)",₹999.00,4.3 out of 5 stars,"225,185 ratings",In stock,amazon_headphone_data
"ZEBRONICS Thunder Max Bluetooth Over Ear Headphone with 120*Hrs Playback, 3 EQ Modes, 40mm Bass Driver, Fast Charging, ENC, Gaming Mode, Dual Pairing, BT v5.4, AUX, Metallic Finish (Black)","₹1,099.00",3.6 out of 5 stars,209 ratings,In stock,amazon_headphone_data
"Logitech H390 Wired On Ear Headset for PC/Laptop, Stereo Headphones with Noise Cancelling Microphone, USB-A, In-Line Controls, Works with Chromebook","₹2,995.00",4.3 out of 5 stars,"59,796 ratings",In stock,amazon_headphone_data
"Boult X Mustang Newly Launched Torq TWS Earbuds with 60H Playtime, App Support, 4 Mics ENC, 45ms Low Latency, 13mm Driver, Breathing LEDs, Touch Control, Made in India, IPX5 Ear buds Wireless (Yellow)","₹1,799.00",4.0 out of 5 stars,"5,563 ratings",In stock,amazon_headphone_data
"Boult Audio Z40 True Wireless in Ear Earbuds with 60H Playtime, Zen™ ENC Mic, Low Latency Gaming, Type-C Fast Charging, Made in India, 10mm Rich Bass Drivers, IPX5, Bluetooth 5.3 Ear Buds TWS (Blue)",₹799.00,3.8 out of 5 stars,"33,610 ratings",In stock,amazon_headphone_data
"hayden HY-HD10 Professional Studio Headphones Over-Ear, Wired, 50mm Drivers, Foldable, Lightweight, Dual Detachable Cables (2.8m Coiled & 1.2m with Mic) for DJ, Gaming, Recording, Mixing, Monitoring","₹1,839.00",4.5 out of 5 stars,74 ratings,In stock,amazon_headphone_data
"boAt Airdopes Progear Open-Ear Ear Buds for Outdoor Sports W/Air Conduction Tech, in Ear, 4 Mics W/Ai-Enx, 100Hrs Playback, 15Mm Drivers, Secure Fit,Beast Mode W/ 40Ms Latency, ASAP Charge Green","₹1,499.00",3.4 out of 5 stars,"1,322 ratings",In stock,amazon_headphone_data
"JBL Tune 760NC, Wireless Over Ear Active Noise Cancellation Headphones with Mic, Upto 50 Hours Playtime, Multi-Device Connectivity, Pure Bass, AUX & Voice Assistant Support for Mobile Phones (Black)","₹4,999.00",3.6 out of 5 stars,"9,811 ratings",In stock,amazon_headphone_data
boAt Bassheads 105 Wired in Ear Earphones with Mic (Black),₹399.00,4.0 out of 5 stars,"38,117 ratings",In stock,amazon_headphone_data
Sonos Ace - Black - Wireless Over Ear Headphones with Noise Cancellation,"₹29,999.00",4.2 out of 5 stars,357 ratings,In stock,amazon_headphone_data
"boAt Rockerz 460 Wireless Over Ear Headphones w/Up to 30hrs Playtime, 40mm Drivers, Beast™ Mode, ENx™, Dual Pairing, BT v5.2, Instant Voice Assistant, Adaptive Fit(Crimson White)",₹999.00,4.0 out of 5 stars,352 ratings,In stock,amazon_headphone_data
"boAt Rockerz 550 Over Ear Bluetooth Headphones with Upto 20 Hours Playback, 50MM Drivers, Soft Padded Ear Cushions and Physical Noise Isolation, Without Mic (Army Green)","₹1,599.00",4.0 out of 5 stars,"66,992 ratings",In stock,amazon_headphone_data
"Ambrane Wired in Ear Earphones with in-line Mic for Clear Calling, 14mm Dynamic Drivers for BoostedBass, 3.5mm Jack, Multi-Functional Controller (Stringz 38 Lite, Green)",₹149.00,3.8 out of 5 stars,"5,305 ratings",In stock,amazon_headphone_data
"Noise Two Wireless On-Ear Headphones with 50 Hours Playtime, Low Latency(up to 40ms), 4 Play Modes, Dual Pairing, BT v5.3 (Bold Black)","₹1,299.00",3.5 out of 5 stars,"3,215 ratings",In stock,amazon_headphone_data
"boAt Rockerz 450, 15 HRS Battery, 40mm Drivers, Padded Ear Cushions, Integrated Controls, Dual Modes, On Ear Bluetooth Headphones, Wireless Headphone with Mic (Luscious Black)","₹1,299.00",4.5 out of 5 stars,"116,762 ratings",In stock,amazon_headphone_data
"Boult K10 Truly Wireless Bluetooth In Ear Earbuds with 50H Playtime, 4 Mic Clear Calling, 45ms Low Latency, 10mm Drivers, Touch Controls, Type-C Fast Charging, IPX5, TWS Ear buds Wireless (Pure Black)",₹699.00,4.1 out of 5 stars,"3,808 ratings",In stock,amazon_headphone_data
"Boult Newly Launched Flex Over Ear Bluetooth Headphones with 70H Playtime, 40mm Bass Drivers, Zen™ ENC Mic, Type-C Fast Charging, 4 EQ Modes, Bluetooth 5.4, AUX Option, IPX5 Navy Blue","₹1,299.00",Previous page,,In stock,amazon_headphone_data
"soundcore V20i by Anker Open-Ear Headphones, Adjustable Ear Hooks, Ultra-Comfort, Snug Fit, Powerful Sound, Clear Calls, IP55, LED Lights, 36H Playtime, Bluetooth 5.4 Earbuds, Multipoint Connection","₹2,499.00",4.4 out of 5 stars,"3,172 ratings",In stock,amazon_headphone_data
"Sennheiser Accentum Wireless Bluetooth Over Ear Headphones with Mic-Designed in Germany Audio,50Hr Battery,10 Min Quick Charge = 5Hr Playback,Hybrid ANC","₹10,990.00",4.0 out of 5 stars,"1,236 ratings",In stock,amazon_headphone_data
Blaupunkt Newly Launched BH41 Bluetooth Wireless Over Ear Headphones I Long Playtime I 40MM Drivers I Foldable I Flexible & Light Weight I Built in Mic I TurboVolt Fast Charging,₹999.00,3.9 out of 5 stars,214 ratings,In stock,amazon_headphone_data
boAt Bassheads 152 in Ear Wired Earphones with Mic(Raging Red),₹499.00,4.1 out of 5 stars,"78,728 ratings",In stock,amazon_headphone_data
"ZEBRONICS Boom Wired Headphone, Over Ear, in-Line MIC, Foldable, 1.5 Meter Cable, for 3.5mm (Mobile | Tablet | Laptop | MAC), Soft Cushion, 40mm Drivers (Black)",₹493.00,2.9 out of 5 stars,343 ratings,In stock,amazon_headphone_data
"Kratos Neckband Bluetooth Headphones with 20 Hours Playtime with 13mm Drivers, Rich Music Experience, Type C Fast Charging, Neckband Earphones with Voice Assistant & IPX4 Water Resistant",₹299.00,4.2 out of 5 stars,280 ratings,In stock,amazon_headphone_data
"ZEBRONICS Thunder Bluetooth 5.3 Wireless Over Ear Headphones with 60H Backup, Gaming Mode, Dual Pairing, Enc, Aux, Micro Sd, Voice Assistant, Comfortable Earcups, Call Function (Teal Green)",₹699.00,3.8 out of 5 stars,"76,711 ratings",In stock,amazon_headphone_data
Sony MDR-EX15AP EX Stereo Headphones with Mic (Black),₹699.00,3.8 out of 5 stars,"7,700 ratings",In stock,amazon_headphone_data
"Boult Audio Z40 True Wireless in Ear Earbuds with 60H Playtime, Zen™ ENC Mic, Low Latency Gaming, Type-C Fast Charging, Made in India, 10mm Rich Bass Drivers, IPX5, Bluetooth 5.3 Ear Buds TWS (Blue)",₹799.00,3.8 out of 5 stars,"33,610 ratings",In stock,amazon_headphone_data
"Boult X Mustang Newly Launched Torq TWS Earbuds with 60H Playtime, App Support, 4 Mics ENC, 45ms Low Latency, 13mm Driver, Breathing LEDs, Touch Control, Made in India, IPX5 Ear buds Wireless (Yellow)","₹1,799.00",4.0 out of 5 stars,"5,563 ratings",In stock,amazon_headphone_data
"boAt Rockerz 425 Bluetooth Wireless Over Ear Headphones with Mic with Signature Sound, Beast Mode(Upto 65Ms Low Latency) for Gaming Enx Tech, ASAP Charge 25H Playtime V5.2, Dual Pairing (Oceana Blue)","₹1,099.00",3.6 out of 5 stars,"3,745 ratings",In stock,amazon_headphone_data
"boAt Rockerz 255 Pro in Ear Bluetooth Neckband with Upto 10 Hours Playback, ASAP™ Charge, IPX5, Signature Sound & Integrated Controls(Navy Blue)","₹1,399.00",4.1 out of 5 stars,"83,597 ratings",In stock,amazon_headphone_data
"Bose New QuietComfort Ultra Wireless Noise Cancelling Headphones with Spatial Audio, Over-The-Ear Headphones with Mic, Up to 24 Hours of Battery Life, Black","₹28,699.00",4.4 out of 5 stars,"6,136 ratings",In stock,amazon_headphone_data
"ZEBRONICS Duke Wireless Headphone with Up to 60h Backup, Supports Bluetooth, Dual Pairing, Gaming Mode, Environmental Noise Cancellation (ENC), LED Lights, Deep Bass, Voice Assistant Support (Blue)","₹1,399.00",3.7 out of 5 stars,"14,821 ratings",In stock,amazon_headphone_data
"Zebronics-Bang over the ear headphones with Foldable Design and Bluetooth v5.0 headphones, Providing up to 20h* Playback(Red)",₹699.00,3.7 out of 5 stars,"11,256 ratings",In stock,amazon_headphone_data
"JBL C200SI, Premium in Ear Wired Earphones with Mic, Signature Sound, One Button Multi-Function Remote, Premium Metallic Finish, Angled Earbuds for Comfort fit (Gun Metal)",₹749.00,3.9 out of 5 stars,"26,581 ratings",In stock,amazon_headphone_data
"JBL Quantum 100 Wired Over Ear Gaming Headphones with Mic, 40mm Realistic Dynamic Drivers, Detachable Boom Mic, 1kHz Sensitivity, Memory Foam Cushioning, PC/Mobile/PS/Xbox/Nintendo/VR Compatible-Blue","₹1,999.00",3.9 out of 5 stars,"3,938 ratings",In stock,amazon_headphone_data
"EPOS PC 8 USB A On-Ear Stereo Wired Headset with Microphone, Wired Headphones, Inline Volume Control, Mute Function, Noise-Canceling Microphone, for Laptop, PC, Mac - Online Calls, Teaching","₹2,421.00",3.9 out of 5 stars,"16,308 ratings",In stock,amazon_headphone_data
"boAt Rockerz 450, 15 HRS Battery, 40mm Drivers, Padded Ear Cushions, Integrated Controls, Dual Modes, On Ear Bluetooth Headphones, Wireless Headphone with Mic (Luscious Black)","₹1,299.00",4.5 out of 5 stars,"116,762 ratings",In stock,amazon_headphone_data
"Noise Two Wireless On-Ear Headphones with 50 Hours Playtime, Low Latency(up to 40ms), 4 Play Modes, Dual Pairing, BT v5.3 (Calm White)","₹1,299.00",3.5 out of 5 stars,"3,215 ratings",In stock,amazon_headphone_data
"Boult Newly Launched Flex Over Ear Bluetooth Headphones with 70H Playtime, 40mm Bass Drivers, Zen™ ENC Mic, Type-C Fast Charging, 4 EQ Modes, Bluetooth 5.4, AUX Option, IPX5 Navy Blue","₹1,299.00",Previous page,,In stock,amazon_headphone_data
"JLab JBuds LUX ANC Smart Active Noise Cancelling Headphones - Over Ear Wireless Headphones with Microphone, 70+ H Playtime Foldable Bluetooth Earphones with Multipoint & Customisable Sound, Graphite","₹5,999.00",4.5 out of 5 stars,"2,035 ratings",In stock,amazon_headphone_data
"Zebronics-Bang over the ear headphones with Foldable Design and Bluetooth v5.0 headphones, Providing up to 20h* Playback(Red)",₹699.00,3.7 out of 5 stars,"11,256 ratings",In stock,amazon_headphone_data
"Boat Rockerz 255 Touch Neckband with Full Touch Controls, Spatial Audio, Up to 30H Playtime, ASAP™ Charge, Beast™ Mode, ENx™ Technology(Deep Blue)",₹899.00,3.9 out of 5 stars,"225,185 ratings",In stock,amazon_headphone_data
"ZEBRONICS Thunder Pro Wireless Over Ear Headphone with Dual Pairing, Gaming Mode, Enc, Bluetooth, Call Function, Aux, Micro Sd, Voice Assistant, Deep Bass, Up to 60H Backup (Blue)",₹718.00,3.8 out of 5 stars,"76,711 ratings",In stock,amazon_headphone_data
"boAt Rockerz 460 Wireless Over Ear Headphones W/Up to 30Hrs Playtime, 40Mm Drivers, Signature Sound, Beast Mode, Enx, Dual Pairing, Bt V5.2, Instant Voice Assistant, Adaptive Fit(Bold Blue)","₹1,199.00",4.0 out of 5 stars,352 ratings,In stock,amazon_headphone_data
"ZEBRONICS RAGA F2, Bluetooth Neckband, 22 Hours Playback, ENC, Rapid Charging, Dual Pairing, Magsnap (Magnetic Play | Pause), 2 EQ Modes, Bluetooth v5.4, Call Function, Gaming Mode (Blue)",₹749.00,5.0 out of 5 stars,17 ratings,In stock,amazon_headphone_data
"ZEBRONICS Duke Wireless Headphone with Up to 60h Backup, Supports Bluetooth, Dual Pairing, Gaming Mode, Environmental Noise Cancellation (ENC), LED Lights, Deep Bass, Voice Assistant Support (Beige)",₹998.00,3.7 out of 5 stars,"14,821 ratings",In stock,amazon_headphone_data
"ZEBRONICS Duke Plus, Wireless Over Ear Headphone with ANC, ENC, Gaming Mode, Dual Pairing, Rapid Charge, Upto 70* Hours Backup, Bluetooth v5.4, AUX, Comfortable Earcushion, Deep Bass (Black)","₹1,599.00",3.7 out of 5 stars,"14,821 ratings",In stock,amazon_headphone_data
"JBL Quantum 100 Wired Over Ear Gaming Headphones with Mic, 40mm Realistic Dynamic Drivers, Detachable Boom Mic, 1kHz Sensitivity, Memory Foam Cushioning, PC/Mobile/PS/Xbox/Nintendo/VR Compatible-Black","₹1,899.00",3.9 out of 5 stars,"15,474 ratings",In stock,amazon_headphone_data
"Boult K10 Truly Wireless Bluetooth In Ear Earbuds with 50H Playtime, 4 Mic Clear Calling, 45ms Low Latency, 10mm Drivers, Touch Controls, Type-C Fast Charging, IPX5, TWS Ear buds Wireless (Pure Black)",₹699.00,4.1 out of 5 stars,"3,808 ratings",In stock,amazon_headphone_data
Sonos Ace - White - Wireless Over Ear Headphones with Noise Cancellation,"₹29,999.00",4.2 out of 5 stars,357 ratings,In stock,amazon_headphone_data
"Skullcandy Crusher ANC 2 Over-Ear 4-mic Active Noise Cancelling Wireless Headphones with Sensory Bass, 40mm Drivers, Dual Pairing,Flat-Folding & Collapsible Design, Alexa Enabled, 50Hr Playtime- Bone","₹18,999.00",4.5 out of 5 stars,"2,434 ratings",In stock,amazon_headphone_data
"boAt New Launch Rockerz 650 Pro, Touch/Swipe Controls, Dolby Audio, 80Hrs Battery, 2Mics ENx, Fast Charge, App Support, Dual Pair, Bluetooth Headphones, Wireless Headphone with Mic (Starry Night)","₹2,499.00",4.2 out of 5 stars,193 ratings,In stock,amazon_headphone_data
"Noise Airwave Max 3 Bluetooth On-Ear Headphones with 70H Playtime, 40mm Driver, Low Latency(up to 45ms),Dual Pairing, BT v5.3 (Carbon Black)","₹1,499.00",3.9 out of 5 stars,"1,882 ratings",In stock,amazon_headphone_data
Audio-Technica ATH-M20x Over-Ear Professional Studio Monitor Headphones,"₹4,249.00",4.4 out of 5 stars,"24,304 ratings",Only 2 left in stock.,amazon_headphone_data
"ZEBRONICS AEON Wireless Headphone with 110h Battery Backup, Supports Bluetooth & AUX, Gaming Mode, ENC, Dual Pairing, Rapid Charging (Beige)","₹1,799.00",3.1 out of 5 stars,399 ratings,In stock,amazon_headphone_data
Sennheiser HD 400s Over Ear Wired Headphones with Mic (Black),"₹4,490.00",4.1 out of 5 stars,"4,171 ratings",In stock,amazon_headphone_data
"boAt Rockerz 550 Bluetooth Wireless Over Ear Headphones with Mic Upto 20 Hours Playback, 50MM Drivers, Soft Padded Ear Cushions and Physical Noise Isolation (Red)","₹1,599.00",4.0 out of 5 stars,"66,992 ratings",In stock,amazon_headphone_data
"realme Buds Wireless 3 Neo in Ear Bluetooth Neckband with 13.4 Mm Dynamic Bass Boost Driver,Upto 32 Hours Playback,Fast Charge, Ai Enc,45Ms Low Latency,Ip55 Dust&Water Resistannt&Bluetooth V 5.4,Blue",₹999.00,4.3 out of 5 stars,"18,636 ratings",In stock,amazon_headphone_data
"HAMMER Bash 2.0 Over The Ear Wireless Bluetooth Headphones with Mic, Deep Bass, Foldable Headphones, Upto 8 Hours Playtime, Workout/Travel, Bluetooth 5.0 (Grey)","₹1,899.00",3.7 out of 5 stars,"3,242 ratings",In stock,amazon_headphone_data
"AKG K702 Reference Studio Headphones - Over Ear, Black With Wired Connection","₹8,999.00",4.3 out of 5 stars,"4,243 ratings",In stock,amazon_headphone_data
"boAt New Launch Rockerz 650 Pro, Touch/Swipe Controls, Dolby Audio, 80Hrs Battery, 2Mics ENx, Fast Charge, App Support, Dual Pair, Bluetooth Headphones, Wireless Headphone with Mic (Iris Black)","₹2,499.00",4.3 out of 5 stars,193 ratings,In stock,amazon_headphone_data
"boAt Rockerz 480 w/RGB LEDs, 6 Light Modes, 40mm Drivers, Beast Mode, 60hrs Playback, ENx Tech, BT v5.3, Adaptive Fit & Easy Access Controls, Bluetooth Headphones(Black Sabre)","₹1,499.00",3.8 out of 5 stars,614 ratings,In stock,amazon_headphone_data
"Marshall Major V Wireless On-Ear Headphones, Black","₹14,999.00",4.5 out of 5 stars,743 ratings,In stock,amazon_headphone_data
"OnePlus Bullets Z2 Bluetooth Wireless in Ear Earphones with Mic, Bombastic Bass - 12.4 Mm Drivers, 10 Mins Charge - 20 Hrs Music, 30 Hrs Battery Life (Jazz Green)","₹1,299.00",4.3 out of 5 stars,"190,778 ratings",In stock,amazon_headphone_data
"Cosmic Byte GS430 Gaming wired over ear Headphone, 7 Color RGB LED and Microphone",₹899.00,4.0 out of 5 stars,"15,290 ratings",In stock,amazon_headphone_data
"JBL Tune 510BT, On Ear Wireless Headphones with Mic, up to 40 Hours Playtime, Pure Bass, Quick Charging, Dual Pairing, Bluetooth 5.0 & Voice Assistant Support for Mobile Phones (White)","₹1,999.00",3.9 out of 5 stars,"18,079 ratings",In stock,amazon_headphone_data
"boAt Rockerz 430 w/ 40mm Drivers, Beast Mode w/ 40ms Latency, 40hrs Playback, ENx Tech, Voice Assistant, BTv5.4, Adaptive Fit & Easy Access Controls, Bluetooth Headphones(Sage Green)","₹1,199.00",3.1 out of 5 stars,955 ratings,In stock,amazon_headphone_data
"realme Buds Wireless 3 Neo in Ear Bluetooth Neckband with 13.4 Mm Dynamic Bass Boost Driver,Upto 32 Hours Playback,Fast Charge, Ai Enc,45Ms Low Latency,Ip55 Dust&Water Resistannt&Bluetooth V 5.4,Blue",₹999.00,4.3 out of 5 stars,"18,636 ratings",In stock,amazon_headphone_data
"Portronics Muffs M2 Bluetooth Headphones On Ear with Upto 40 Hrs Playtime, 40mm Dynamic Drivers, AUX 3.5mm, Powerful Bass, Laptop & PC Support, Type C Charging Port, Foldable Design(Black)",₹849.00,3.8 out of 5 stars,372 ratings,In stock,amazon_headphone_data
"Noise Airwave Max 4 Wireless Over-Ear Headphones with 70H Playtime, ENC, 40mm Driver, Low Latency(up to 40ms), Dual Pairing, BT v5.4 (Tropical Teal)","₹2,499.00",3.8 out of 5 stars,"1,687 ratings",In stock,amazon_headphone_data
"Boult K10 Truly Wireless Bluetooth In Ear Earbuds with 50H Playtime, 4 Mic Clear Calling, 45ms Low Latency, 10mm Drivers, Touch Controls, Type-C Fast Charging, IPX5, TWS Ear buds Wireless (Pure Black)",₹699.00,4.1 out of 5 stars,"3,808 ratings",In stock,amazon_headphone_data
Sonos Ace - White - Wireless Over Ear Headphones with Noise Cancellation,"₹29,999.00",4.2 out of 5 stars,357 ratings,In stock,amazon_headphone_data
"ZEBRONICS Bro in Ear Wired Earphones with Mic, 3.5mm Audio Jack, 10mm Drivers, Phone/Tablet Compatible (Black)",₹139.00,3.5 out of 5 stars,"58,660 ratings",In stock,amazon_headphone_data
"Dicto Ultrapod Pro Earbuds Bluetooth Wireless, Transparent Charging Case, Active Noise Cancellation, Led Digital Display, Bluetooth in-Ear Headphones, Touch Control, Water Resistant(Black)",₹399.00,1.4 out of 5 stars,3 ratings,In stock,amazon_headphone_data
"pTron Boom Ultima 4D Dual Driver, in Ear Gaming Wired Headphones with in-Line Mic, Volume Control & Passive Noise Cancelling Boom 3 Earphones - (Dark Blue)",₹279.00,3.6 out of 5 stars,"43,890 ratings",In stock,amazon_headphone_data
"Sennheiser Momentum 4 Wireless Over Ear Headphones Designed in Germany - Bluetooth Adaptive Noise Cancelling-ANC,4 Digital Mics for Crystal-Clear Calls,60h Battery, 2 Yr Warranty, Black/Copper","₹21,990.00",4.4 out of 5 stars,"8,566 ratings",In stock,amazon_headphone_data
"ZEBRONICS Duke Plus, Wireless Over Ear Headphone with ANC, ENC, Gaming Mode, Dual Pairing, Rapid Charge, Upto 70* Hours Backup, Bluetooth v5.4, AUX, Comfortable Earcushion, Deep Bass (Beige)","₹1,599.00",3.7 out of 5 stars,"14,821 ratings",In stock,amazon_headphone_data
HyperX CloudX Stinger 2 Core Gaming Headset for Xbox - White (6H9B7AA),"₹2,620.00",4.2 out of 5 stars,520 ratings,In stock,amazon_headphone_data
